Name	title	coding
t3_jxotoe	Trump’s lawsuits plagued by spelling errors: ‘I’ve never seen an election lawyer handle a case as poorly as Giuliani has’	
t3_jxovi4	Latinas for Trump founder unseated Florida Democrat after ‘shadow candidate’ with his surname entered the race	
t3_jyhm4p	Op-Ed: Why Biden should look beyond the usual pool for his Cabinet appointments	
t3_jy834q	Trump Owned By Parody Twitter Account He Apparently Believed Was His Sister’s	
t3_jxtupb	'Call His Bluff': Edward Norton's Viral Message On Trump	
t3_jxxh0e	Detroit asks judge to sanction Trump campaign for spreading 'disinformation'	
t3_jyfexo	Biden faces a race against the clock for U.S. to rejoin Iran nuclear deal | KTAB	
t3_jyi6gg	With Trump victory in Florida, the state turned a deeper red. What does it mean for future elections?	
t3_jyf3ye	Biden wades into coronavirus relief fight	
t3_jygux6	Analysis | The Pa. county that explains how Biden won big while other Democrats struggled	
t3_jxuleo	It’s time for everyone to pick a side: America or President Trump	
t3_jy2x8h	Michigan election staff recommend certification of Biden win	
t3_jya718	Blocked by Trump, Biden forced to use transition workarounds	
t3_jyh1d4	Biden could announce Cabinet picks as soon as next week	
t3_jxszoj	Federal Judge Strikes DOJ from the Docket in E. Jean Carroll’s Case Against Donald Trump	
t3_jxqenc	Trump's emotional state is 'quite fragile' after election loss	
t3_jya72i	Two weeks after Biden named President-elect, Trump faces stinging setbacks	
t3_jxw9t2	After Years of Watching ‘Trump Show,’ TV News Starts to Turn it Off	
t3_jy9clr	Trump wanted to bomb Iran — and still could — leaving Biden to pick up the pieces	
t3_jyb540	Where and why President Trump’s election challenges are falling flat in court: explainer	
t3_jycmh4	A destructive legacy: Trump bids for final hack at environmental protections	
t3_jxogw4	Trump lawyers filed a motion in Pennsylvania to clarify they only want to block the state from certifying results of the presidential elections, not any other races on the same ballot	
t3_jyjte3	Ilhan Omar Urges Biden to ‘Reverse’ President Trump’s Middle East Agreements -- Thinks that peace between Israel and Arab nations is a bad thing.	
t3_jyl85p	Judge Dismisses Trump Campaign Suit to Invalidate PA Election Certification With Prejudice	
t3_jylbj0	CNN Condemns Trump Rallies As 'Physically Peaceful But Morally Violent'	
t3_jylfat	Hispanic Voters In Florida Who Fled Dictatorships Think The Election Was Stolen From Trump	
t3_jygwhl	Donald Trump Improved Standing With Latinos In 78 Of America’s 100 Majority-Hispanic Counties	
t3_jym9cn	Pennsylvania Judge Dismisses Trump Campaign's Challenge to Pennsylvania Election Law	
t3_jyby0o	Trump Announces Groundbreaking Rules to Lower Prescription Drug Prices	
t3_jykyw7	Federal Election Commission Chair: Trump Campaign Has Legitimate Claims of Election Fraud	
t3_jyaufj	Berkeley professor sparks outrage by claiming Trump supporters who have an 'indifference' to COVID are like Germans who 'ignored and profited from the Holocaust'	
t3_jynua5	Release: Toomey Statement on PA Federal Court Decision, Congratulates President-elect Biden | U.S. Senator Pat Toomey of Pennsylvania	
t3_jykt0d	Michigan AG Suggests Criminally Charging Republican Legislators for Meeting With Trump	
t3_jydj00	LIVE: March for Trump in Atlanta, Georgia	
t3_jynp3x	Trump Orders Hasty Afghanistan, Iraq Drawdowns to Beat Biden Inauguration	
t3_jyhhtr	McEnany: Trump's path to victory is Supreme Court, exposing 'systemic' voter fraud	
t3_jydzd2	Twitter says it will hand control of US president's official account to Joe Biden on January 20 - regardless of whether Donald Trump has left the White House	
t3_jymov0	Trump Warns 'Massive Fraud' to Be Uncovered in Michigan Vote	
t3_jyn4xj	Trump campaign statement on Pennsylvania ruling	
t3_jygs96	Merkel's Germany Tells Trump Not to Bring Troops Home from Afghanistan	
t3_jy56dt	Trump Announces New Regulations Lowering Prescription Drug Costs	
t3_jyfij4	Georgia Gov. Kemp Calls for Audit, Says Trump Can Demand New Recount	
t3_jybrmo	Joe Biden's 'Vote Joe' website defaced by Turkish Hackers	
t3_jykdwj	Twitter Plans To Hand @POTUS Handle Over To Biden On Jan. 20 No Matter What	
t3_jyobi4	Michigan Legislators Face Calls For Possible Criminal Charges After Meeting With President Trump On Certification	
t3_jy9egu	Joe Biden loses it at reporter who asked about kids going back to classrooms - then tells press to leave	
t3_jygoog	Trump voters back the President’s charges of election fraud led by Democrats	
t3_jyoerq	'Very strange': Devin Nunes says Democrats lack confidence in Biden victory	
t3_jy248u	Anti-Trump Legal Team Withdraws In Pennsylvania	
t3_jy8qby	Joe Biden: Why Are Reporters Asking Me Questions? On Friday, Biden appeared dumbfounded as to why a reporter was asking the projected Democratic presidential-elect a question as the press pool was being scurried away by staff.	
t3_jy4x55	Harvard Students Demand That Trump Officials Be Preemptively Barred From Campus	
t3_jybfam	BLM, Squad members pushing Dems, Biden to abolish prison	
t3_jy2icm	Donald Trump Jr. tests positive for COVID-19	
t3_jyb4tl	6 Big Claims by Trump’s Lawyers About Overturning Election Results	
t3_jybaah	Rudy and Sidney’s Krakentastic Spectacle, and What It Could Mean -- A dismissive legacy media might have panned Team Trump’s press conference Thursday, but it was a significant moment with significant portents.	
t3_jyhsxr	Brian Williams mocks Geraldo Rivera suggestion to name COVID-19 vaccine after Trump	
t3_jyl3oo	Why Joe Biden’s ‘We Just Did’ hats lack the staying power of MAGA caps	
t3_jy1csd	Hispanic Voters in Florida Feel Election Was Stolen from Trump	
t3_jychbs	Ben Carson credits Trump's action after becoming 'desperately ill' with COVID: 'Saved my life'	
t3_jygabf	Ilhan Omar Urges Biden To ‘Reverse’ President Trump’s Middle East Agreements	
t3_jyoy6m	Biden to ‘Racist’ Trump Voters: ‘Let’s Heal.’ That’s Easy for Him to Say.	
t3_jyf2js	Biden says in video he has created 'voter fraud organization'	
t3_jxraf0	While You Were Focused on The Kraken, the Senate Continued Confirming Trump Federal Judges	
t3_jyd2rr	Watch: Sidney Powell – Millions of DEAD People Voted! 7 Million Votes STOLEN From Trump!	
t3_jy240e	How Christianity Gained Cultural Momentum In The Trump Era -- Some celebrities are not just talking the talk, but they seem to be walking a walk that seems to counter what Hollywood culture promotes and accepts.	
t3_jy8kt6	Obama to produce Netflix series about Trump transition, unclear whether it will include abusing intel agencies to spy on successor	
t3_jyfjr4	Trump Objects to Counting Thousands of Wisconsin Ballots	
t3_jyc5wq	Bo Erickson of CBS asks Biden about his son. He says it's just a smear campaign.	
t3_jxocbx	[Not Satire] National Democratic Party official suggests re-education for Trump supporters: 'How do you deprogram 75 million people?'	
t3_jy6x6f	Whatever Happens In The Next Few Weeks, Brothers and Sisters, Remember This Clip, My Favorite 60 seconds of Trump: 'I am your voice'	
t3_jymbgb	BLM Co-Founder Calls on Biden to Back a Crazy Progressive 'Civil Rights' Bill	
t3_jy16dv	New Senate Report Confirms Hunter Biden's Biz ties to CCP, Raises Troubling Ties to Kremlin	
t3_jy44lw	Trump Leads Voyage Of Pilgrims To Greenland To Establish Even Better America	
t3_jy6h4r	Romney on Trump election tactics: 'Difficult to imagine a worse, more undemocratic action' by president	
t3_jy0pv9	Chris Evans and Zach Braff Encourage Keeping Track of Trump ‘Enablers’	
t3_jy47z9	Biden Mocks a Reporter for Asking a Question as Biden's Staff Tries to Get the Press Out of There	
t3_jy0m21	Donald Trump returns to the White House briefing room claiming he 'won' and suggests Pfizer held back vaccine to sabotage his election and says without him the drug would have taken four YEARS	
t3_jy1crk	Trump Touts New Rules to 'End Global Free Loading' of Prescription Drugs	
t3_jy17l6	"Kayleigh McEnany Obliterates Both Dems, Media for Hypocrisy Over Election Results, Completely Levels CNN Reporter: ""Where were the calls for unity and a peaceful transition when President Trump was elected in 2016?"""	
t3_jxod6m	'No national shutdown': Joe Biden says shutting down the virus will not require a national lockdown	
t3_jxnh2b	Lawyer working on Trump Pennsylvania effort placed under official protection due to threats	
t3_jy0vje	Trump's daughter-in-law Lara reported to be considering 2022 Senate run	
t3_jy0aqe	BLM Co-founder: Biden's election was 'won by Black people', 'We want something for our vote.'	
t3_jxochk	New Senate report purportedly 'confirms' Biden family's business ties to Chinese, Russian governments	
t3_jxrzlp	Obama Tells Jimmy Kimmel: 'We Can Always Send the Navy SEALS' to Remove Trump from White House	
t3_jxzw8k	Donald Trump: ‘Big Pharma’ Purposely Delayed Coronavirus Vaccine Until After Election	
t3_jy2rb5	Trump lifts travel ban on Chad	
t3_jxsfmb	Whoa: Nearly a Third of Democrats Believe the Election Was Stolen From Trump	
t3_jxrnvy	Tucker Carlson​ says Trump attorney Sidney Powell wouldn't provide him with any evidence of election fraud. Powell hits back.	
t3_jxxtr7	Trump lawyers cited Minnesota counties in affidavit about Michigan: report	
t3_jxuonz	Elected DNC Member Floats Re-Education Camps for Trump Supporters	
t3_jxx2eu	Nancy Pelosi calls Trump a 'Psychopathic Nut'	
t3_jy0dkc	Donald Trump Jr. tests positive for COVID-19	
t3_jy0f6f	Donald Trump Jr tests positive for coronavirus	
t3_jxsv1q	Trump Campaign Fact-Checks the Media: Georgia Has Not Certified Biden's Win	
t3_jy1cs3	Bigot: Joe Biden Lackey Wanted to Destroy Amy Coney Barrett Because She's Catholic	
t3_jy1cr9	Gregg Jarrett Has an Important Reminder for the Media About the Trump Campaign's Evidence of Voter Fraud	
t3_jy3xhk	Catholics sounding alarm about Biden administration, conflicts with moral teachings	
t3_jy0ud9	‘Enormously insulting’: Sanders warns Biden not to shut out progressives	
t3_jxtmra	'We are a nation of laws, not tweets': Republican Sens. Romney and Sasse decry Trump efforts to challenge election	
t3_jxtoaq	Georgia certifies election results, making Biden win official	
t3_jxvx68	Biden stuggles with words at press conference -- 'I'm going to ... employ the defense, reconstruct the act'	
t3_jxny9j	Trump Legal Adviser Jenna Ellis Rips Media: ‘You Are Not Unbiased Jurors’	
t3_jym704	Obama Appointed Federal Judge Dismisses Trump Campaign Lawsuit in Pennsylvania	
t3_jxxelw	Trump Appears To Doubting Tucker And Lets Him Touch The Fraudulent Ballots Himself	
t3_jxsxuq	National Democratic Party official suggests re-education for Trump supporters: 'How do you deprogram 75 million people?'	
t3_jy0cbd	Opinion | Georgia Certifies: Donald Trump Lost	
t3_jxz4ek	Biden to Impose $200 Gun Tax | Americans for Tax Reform	
t3_jxo83f	Hunter Biden had deep business ties with communist party-linked Chinese tycoon: new Senate report	
t3_jxq1j3	Joe Biden stays silent over proposed meeting with BLM founder	
t3_jxvhyz	Lin Wood: President Trump won 400 electoral votes | One America News Network	
t3_jxuoli	Biden certified Georgia winner after hand recount	
t3_jy0r0u	Obamas producing Netflix anti-Trump comedy show	
t3_jxtalp	Intimidation Tactics Against Trump Lawyers Undermine Justice	
t3_jxxjgh	Giuliani, other Trump lawyers to skip meeting with Michigan lawmakers after COVID-19 exposure	
t3_jxow0s	Satire: Obama: 'Biden Has Touched Us All'	
t3_jxnwph	Catholic Bishop: 'I Beg Mr. Biden to Repent of His Dissent From Catholic Teaching on Abortion &amp; Marriage'	
t3_jxtkh6	Georgia Secretary of State Certifies Biden’s Win After Audit	
t3_jxgzoc	Trump campaign statement on Georgia	
t3_jy9cvg	U.S. Corporations with 'Made in China' Goods 'Optimistic' About Joe Biden	
t3_jz3tl3	Michael J. Fox says Donald Trump has played on 'every worst instinct in mankind': 'Biff is president!'	
t3_jz0akg	Trump, GOP’s ridiculous, flailing coup isn’t a joke. It’s a crime. There must be consequences | Will Bunch	
t3_jyzr2m	A Republican judge just tore into Trump’s election lawyers for their incompetence. Trump’s lawyers asked a judge to disenfranchise nearly 7 million voters. It ended badly for Trump.	
t3_jz44h2	Bernie Sanders says GOP ‘has ceased to be a political party’ and is now a ‘cult’ in fiery rebuke of Trump fraud claims	
t3_jz1z65	‘Stop golfing and concede’: Trump and Maryland Gov. Hogan spar again after president criticizes South Korean tests	
t3_jz5bfz	Trump campaign says Sidney Powell isn't a member of its legal team	
t3_jz0b6y	Claim that Trump 'was never given an orderly transition of power' is false	
t3_jz227v	GOP Senator Has Instructed Staff to Cooperate With Biden Transition, Says It's 'Past Time' for Trump to Do Same	
t3_jyy98l	Stacey Abrams helped register 800,000 voters and flipped Georgia for Biden. Here's what anyone can learn from her ability to inspire and influence others.	
t3_jz4z41	No, You Do Not Have to Feel the Trump Voter's Pain | There is no reason, after five and half years of untruths, dog-whistles, slurs and conspiracies, and weeks of Trump trying to undermine Biden’s win, to hug the people who want to disenfranchise you	
t3_jyxn1c	"Chris Christie: Trump's legal challenges against election results have been ""a national embarrassment"""	
t3_jz5qcv	Brian Stelter Slams Lara Trump For Declaring Trump Voters Don’t ‘Feel’ That He Lost - “Facts do not care about your feelings,” the CNN host said.	
t3_jz0yry	"GOP Governor On Trump's Election Tantrum: Beginning To Look Like A 'Banana Republic' - ""Frankly, I'm embarrassed that more people in the party aren’t speaking up,"" Maryland Gov. Larry Hogan said."	
t3_jywaur	3 ‘dead’ Georgia voters in fact very much alive: Trump, Tucker Carlson get it wrong	
t3_jz2pba	Small but growing number of Republicans tell Trump it’s over: “Stop golfing and concede”	
t3_jywjti	40% of Top Pentagon Positions Empty After Donald Trump's Firing of Mark Esper	
t3_jyxqd1	Chris Christie: Trump's legal team 'a national embarrassment'	
t3_jyyf6p	'Unacceptable': Wisconsin Election Officials Say Trump Observers Hindering Recount With Constant Interruptions, Questions	
t3_jz0eog	In Public, Trump Still Claims He Won. In Private, Aides Say He’s Planning for Life After Presidency.	
t3_jz1bxs	Biden reaches out. The GOP slaps him in the face.	
t3_jyxn3r	Hogan 'embarrassed that more people' in the GOP 'aren't speaking up' against Trump	
t3_jyvrie	Trump's embarrassing, incompetent, humiliating, very sad coup	
t3_jz6vh9	"Murkowski tells Trump: ""It is time to begin the full and formal transition process"""	
t3_jz67og	Trump Yet to Answer One Press Question Since Election As GOP Pressure for His Concession to Biden Grows	
t3_jywxtu	Michigan GOP Congressman Tells Trump 'It's Over': 'The Voters Spoke'	
t3_jyunps	Trump, laden with $400 million debts, plans to cash in on his post-presidency with a book deal, media appearances, and selling rally tickets, according to a report	
t3_jyvoq1	Young voters set turnout record, aiding Biden win	
t3_jyuup3	Trump Wonders Why Joe Biden Is Forming A Cabinet In Latest Tweet Screed	
t3_jz6gek	Trump campaign cuts Sidney Powell from president’s legal team - The abrupt shake-up comes as Powell makes far-fetched and unsupported claims of voter fraud in the 2020 elections.	
t3_jyys5f	Republican Gov. Larry Hogan is 'embarrassed that more people in the party aren't speaking up' against Trump's refusal to concede	
t3_jyyaoi	Trump Requests Georgia Recount, Meaning 5 Million Votes Will Be Tabulated A 3rd Time	
t3_jz3fxh	Claim that Trump 'was never given an orderly transition of power' is false	
t3_jywgwe	Republican senator congratulates Biden telling Trump to ‘accept outcome of election’	
t3_jyxw7j	Biden inauguration will be ‘scaled down’ because of coronavirus, chief of staff says	
t3_jyxlr4	Analysis: Donald Trump has left the world stage. Few will miss him	
t3_jz7cgh	"Trump dumps Sydney Powell, lawyer who promised to ""blow up"" Georgia, as legal strategy unravels"	
t3_jz1nzm	National Review Slams Trump’s Refusal To Concede As ‘A Bid For Infamy’ — The conservative magazine condemned the baseless lawsuits and conspiracies of the Trump legal team as a “profoundly undemocratic gambit.”	
t3_jz4ivr	Nearly all Pa. counties expect to sign off on election results by Monday despite Trump’s attempts to delay certification	
t3_jz1pj8	Mao’s Lesson for Trump’s America | Beware of leaders willing to set their own country on fire.	
t3_jywmds	Split-screen: Biden preps to be president, Trump fights for the job he is ignoring	
t3_jz61e3	Former Ohio Gov. John Kasich Says GOP Is 'Afraid' Of Trump	
t3_jyx75d	House Democratic Caucus chairman: Trump's presidency was a 'scam'	
t3_jyyeac	Chris Christie Tears Into Trump's Legal Team: 'A National Embarrassment'	
t3_jyvt2z	Wisconsin officials: Trump observers obstructing recount | Election officials overseeing the recount of presidential votes in Wisconsin’s largest county are accusing observers for President Donald Trump of unduly slowing the process	
t3_jz4v45	Longtime diplomat says Trump conspiracies hurt U.S. more than Russia, China	
t3_jyvp5p	Federal judge rejects Trump campaign's Pa. lawsuit with prejudice, saying it lacks factual proof	
t3_jyy2z6	Bolton calls on GOP leadership to label Trump's behavior 'inexcusable'	
t3_jz0nbc	Pressure grows from GOP for Trump to recognize Biden election win	
t3_jyrsd4	America is being subjected to a stress test – and Republicans are failing | Most elected Republicans are refusing to stand up to Trump. Their cowardice is one of the worst betrayals of public trust in the history of our republic	
t3_jyzf5a	Hogan: Trump making US look like a 'banana republic'	
t3_jz6p3p	‘Stop Golfing And Concede’ | Gov. Larry Hogan Hits Back At President Trump’s Tweet On South Korea COVID-19 Tests	
t3_jz6si6	Sidney Powell: Trump legal team disavows lawyer who claimed Venezuelan communists helped rig US election	
t3_jz3i4z	"""Stop golfing and concede"": Maryland GOP Governor Larry Hogan spars with Trump"	
t3_jyw4pb	Trump’s legal team cried vote fraud, but courts found none	
t3_jyy5hi	Trump, the Saboteur. First a Tantrum, Then Taking Every Opportunity to Trash Our Government	
t3_jz5jzx	Trump campaign says Sidney Powell not a member of legal team	
t3_jz0mhl	Trump’s wildest claims are going nowhere in court. Thank legal ethics. Thank legal ethics. The president’s lawyers can’t make assertions without evidence in front of judges.	
t3_jz3iys	"Small but growing number of Republicans tell Trump it's over: ""Stop golfing and concede"""	
t3_jz6lhi	Threats to Election Officials Piled Up as President Trump Refused to Concede	
t3_jyqowe	Michiganders Erupt After Their Maskless Lawmakers Sip Dom Perignon At Trump Hotel - Michigan legislators celebrate together after secretive meeting with Trump, who has been plotting to overturn the state’s vote for Joe Biden.	
t3_jz6fej	Trump campaign attempts to distance from conspiracy-theorist lawyer Sidney Powell	
t3_jz7lhm	Edward Norton tears into 'whiny, sulky, petulant, Grinchy, vindictive' Donald Trump in pointed, poker-laced Twitter thread	
t3_jz22oq	Hogan ramps up criticism of Trump: 'Stop golfing and concede'	
t3_jyzx62	Trump faces pressure from Republicans to drop 'corrosive' fight to overturn election	
t3_jz73xa	Judge Dismisses Trump Campaign's Bid To Delay Vote Certification In Pennsylvania	
t3_jz32ir	Larry Hogan to Trump: 'Stop golfing and concede' the election 'If you had done your job, America's governors wouldn't have been forced to fend for themselve,' Hogan said	
t3_jypw7q	Out of 53 Republican senators, only two have stood up to Trump's attempt to overturn the election	
t3_jz404d	Team Trump offering 'fire hose' of conspiracy Kool-Aid for supporters	
t3_jz52gp	'Stop golfing and concede': Gov. Hogan fires back on Pres. Trump's COVID test claims	
t3_jyyvlv	Twitter Recognizes Biden as the Next @POTUS, Despite Trump's Denial	
t3_jz0mm7	Bolton: 'Trump is throwing rocks through windows'	
t3_jyw2mu	Trump threatens to wreak havoc on the GOP from beyond the White House	
t3_jz3dde	Trump is in an unprecedented streak of silence	
t3_jz44bn	The Two Biggest Losers: Trump and Giuliani — The bigoted New York septuagenarians team up for one last hurrah.	
t3_jys1yc	Trump’s tyranny is the moral equivalent of treason	
t3_jz54v1	"Fifth GOP Senator congratulates Biden and Harris, says Trump has ""exhausted all"" Penn. legal options"	
t3_jyqcfr	After Pennsylvania court defeat, Trump faces new pressure to concede election	
t3_jz6cus	Trump campaign purges conspiracy-theorist Sidney Powell from legal team	
t3_jyvv5t	Trump team requests another recount of Georgia’s presidential race, a day after results certified in Joe Biden’s victory	
t3_jz2hti	Biden opens the door to protecting the Arctic Refuge	
t3_jz739w	Wisconsin Trump Campaign Lawyer Trying to Throw Out His Own Vote	
t3_jysd13	Ben Carson Confirms Trump’s Friends Get Better Coronavirus Treatments	
t3_jz2pci	Tapper: Judges are running out of pejoratives for Trump's legal efforts - CNN Video	
t3_jyx06u	Election Updates: Trump Campaign Faces Major Legal Setbacks; Biden Wins Certified	
t3_jz6unm	Lisa Murkowski calls on Trump to end court fights	
t3_jz5yna	Trump Campaign Disavows Its Own Election-Conspiracy Lawyer	
t3_jz45sv	More key Republicans tell Trump to end delays. ‘Past time to start a transition’	
t3_jz265e	Trump’s legal team cried vote fraud, but courts found none	
t3_jz5a2y	Republicans quietly plot to sink Biden nominees	
t3_jz1a2t	Trump Lawyer Sidney Powell Says Georgia Election Lawsuit 'Will Be Biblical,' Suggests GOP Governor Helped Biden	
t3_jyx8pe	Biden aide says GSA holdup prevents background checks on cabinet picks	
t3_jz55kh	Biden Team, Pushing Quick Stimulus Deal, Prepares for Renewed Recession	
t3_jz5oyu	Trump campaign says Sidney Powell not a member of legal team	
t3_jz557f	Pat Toomey: Trump Campaign Has Exhausted Legal Options and Biden Won	
t3_jyobrs	On Parler, a pro-Trump call for Georgia runoff boycott threatens Mitch McConnell's plan to restrain Biden	
t3_jz0fch	Senators push to stop Trump administration’s proposed arms sale to UAE	
t3_jz4wcx	Young voters in the US turned out in record numbers in 2020, powering Biden's presidential victory	
t3_jz828i	Yet another Georgia election official receives threats after state certifies Biden win	
t3_jyoleb	Kayleigh McEnany said Trump wasn't given an 'orderly transition of power' in 2016. He was.	
t3_jyxte1	Trump’s Legal Team Cried Voter Fraud, But Courts Found None	
t3_jyxl4z	Trump ally, former NJ governor Chris Christie: president’s election fraud claims are a ‘national embarrassment’	
t3_jyzag6	Chris Christie Calls Trump Legal Team ‘National Embarrassment,' Tells President to End Election Suits	
t3_jz5ofk	Giuliani distances Trump campaign from attorney Sidney Powell	
t3_jyt5rw	Liz Cheney says Trump should respect ‘sanctity’ of election if he can’t prove claims in court	
t3_jz0vxg	Christie calls Trump's legal efforts a 'national embarrassment' as more Republicans speak out	
t3_jz72fx	Murkowski calls on Trump to begin transition process, decries 'pressure campaign on state legislators'	
t3_jz7o2y	Giuliani releases statement distancing Trump campaign from lawyer Sidney Powell	
t3_jz3pdw	Wisconsin officials: Trump observers obstructing recount	
t3_jz614o	Trump legal team disavows association with lawyer Sidney Powell	
t3_jyzjg9	Congresswoman Liz Cheney is the latest Republican calling on Trump to prove fraud claims in court	
t3_jymtbq	Megathread: Judge Dismisses Trump Lawsuit Seeking to Delay Certification in Pennsylvania	
t3_jz2mz3	Trump Campaign Didn’t Request a Recount in Wisconsin Counties Using Dominion Machines	
t3_jz8bvm	Native American voters across Minnesota turned out to oust Trump - Vote totals were up around Red Lake, and 90% for Biden	
t3_jz42uk	Trump’s legal team cried vote fraud, but courts found none	
t3_jz2555	In last-gasp maneuver, Trump campaign tries to invalidate thousands of votes as Wisconsin recount gets underway	
t3_jyufn4	Trump’s quest to overturn election runs into quiet resistance from local and state Republicans	
t3_jyzjov	Chris Christie dismissed Trump's legal team as 'a national embarrassment'	
t3_jyoi1n	"""Trump has exhausted all plausible legal options"": GOP Sen. Pat Toomey congratulates Biden"	
t3_jyno88	Pa. Senator Pat Toomey Says President Trump Has ‘Exhausted All Plausible Legal Options’	
t3_jz7po7	Biden to Name Longtime Aide Blinken as Secretary of State	
t3_jz2dpu	Chris Christie calls the conduct of Trump’s legal team a ‘national embarrassment’	
t3_jz2ofa	Miami Republicans won’t criticize baseless Trump claims of Venezuelan election rigging	
t3_jyx846	Sen. Toomey Congratulates Biden After Pennsylvania Judge Dismisses Trump Lawsuit	
t3_jz7ynb	More Republicans Tiptoe Toward Acknowledging Biden’s Victory	
t3_jynvr3	Detroit voters sue President Trump over his attempt to block certification of election results	
t3_jz1k5h	Trump team making false argument about his 2016 transition	
t3_jz1j0x	Chris Christie: Trump’s Legal Team Has Been a ‘National Embarrassment’	
t3_jyrnq8	States and Local Republicans standing up to Trump are putting National GOP leaders to shame	
t3_jz7x4k	Trump campaign parts ways with Powell after vote-switching claim	
t3_jz5lhv	Attorney Heading Up Trump Campaign's Wisconsin Recount Effort is Seeking to Throw Out His Own Vote	
t3_jyxajt	After Pennsylvania legal defeat, Trump digs in despite new pressure to concede election	
t3_jz7ko0	Incoming chief of staff says Biden will begin announcing top Cabinet picks this week	
t3_jz088i	Trump team making false argument about his 2016 transition	
t3_jz3wcq	President-elect Joe Biden will announce cabinet picks Tuesday	
