Name	title	coding
t3_jz7cgh	"Trump dumps Sydney Powell, lawyer who promised to ""blow up"" Georgia, as legal strategy unravels"	
t3_jzozd1	Why the Trump campaign’s big legal flameout in Pennsylvania seems like a turning point, even for Republicans	
t3_jzji16	Trump's closest business ally just admitted that the president lost the election	
t3_jzobu4	Behind the scenes, Trump frustrated with his legal team's maneuvers	
t3_jzg8x4	'Elite Strike Force'? Trump Legal Team Throws Right-Wing Attorney Sidney Powell Under the Bus as Coup Attempt Flails	
t3_jziqei	"Team Trump Fired QAnon Lawyer Sidney Powell But She's Tweeting Through It - Last week she was part of Trump's ""elite strike force."" Now she's ""practicing law on her own."""	
t3_jzr5f1	Michigan Election Board Certifies Victory for Biden	
t3_jzt2gz	Whoopi Goldberg blasts Republicans not speaking against Trump: 'This is an attempted coup'	
t3_jzprxe	Trump’s Absurd ‘You Did It First’ Argument for Stealing the Election	
t3_jzpbvs	Biden chooses former Fed Chair Janet Yellen to be Treasury secretary, report says	
t3_jzofom	Biden moves forward as GOP breaks with Trump rise	
t3_jz67og	Trump Yet to Answer One Press Question Since Election As GOP Pressure for His Concession to Biden Grows	
t3_jzhsuf	Trump urges state legislatures and courts to ‘flip’ results	
t3_jz5qcv	Brian Stelter Slams Lara Trump For Declaring Trump Voters Don’t ‘Feel’ That He Lost - “Facts do not care about your feelings,” the CNN host said.	
t3_jzsna1	King of Jordan becomes first Arab leader to speak with President-elect Biden	
t3_jzsfv2	Obama calls Trump era an 'anomaly' in Canada-U.S. relations	
t3_jzo44d	Two years ago this week Trump was mocking a turkey for refusing to concede an election	
t3_jzrzv8	Rush Limbaugh Knocks Trump's Lawyers For Not Providing Voter Fraud Proof	
t3_jzst4r	Trump fears Giuliani, other lawyers in Biden vote challenge are 'fools that are making him look bad'	
t3_jzrnx5	Michigan certifies Biden victory in another blow to Trump	
t3_jzjl2a	Republican national security experts call on Trump to concede, begin transition	
t3_jzfpdr	Donald Trump has assaulted our democracy	
t3_jz5bfz	Trump campaign says Sidney Powell isn't a member of its legal team	
t3_jzukkw	Almost no Trump voters consider Biden the legitimate 2020 election winner, poll says	
t3_jzs6yd	PolitiFact - Trump's Pants on Fire claim about votes exceeding voters in swing states	
t3_jzrztf	CEOs Urge Trump To Concede: 'Not A Moment To Waste' In Fighting COVID-19	
t3_jzr88b	Michigan election board certifies 154,000-vote victory for Joe Biden, another setback in Trump’s effort to overturn election results	
t3_jzmeyu	New report details Trump effort to seize thousands of acres of private land for border wall	
t3_jzsm35	Michigan election board certifies 154,000-vote victory for Joe Biden, another setback in Trump’s effort to overturn election results	
t3_jzu5pb	The Authors of the Dictator’s Handbook on What Trump Is Doing Wrong	
t3_jztaqs	Nancy Pelosi wants Senate hearings for Joe Biden’s nominees before Inauguration Day	
t3_jzkuz6	Trump Faces Growing Calls From Biz Leaders To Concede After Legal Battles Fall Flat	
t3_jzscgu	GM Abandons Trump Admin in Lawsuit Over California Emission Standards, a Sign Automaker Knows Biden Will Be Taking Over	
t3_jzv0k7	Politicizing masks ‘is like politicizing toilet paper,’ Biden coronavirus adviser says	
t3_jz4z41	No, You Do Not Have to Feel the Trump Voter's Pain | There is no reason, after five and half years of untruths, dog-whistles, slurs and conspiracies, and weeks of Trump trying to undermine Biden’s win, to hug the people who want to disenfranchise you	
t3_jzr7kz	Michigan Certifies Joe Biden's Election Victory	
t3_jzsmiy	Trump Fires Sidney Powell for Election Conspiracies as Though He’s Not About to Claim China Paid Poll Workers to Change All the Ballots to Biden	
t3_jzrvao	Michigan votes to certify Biden's win over Trump	
t3_jzp967	General Motors Aligns With Biden, Pulls Out of Lawsuit Supporting Trump	
t3_jzntq8	GM flips to California’s side in emissions lawsuit against Trump admin	
t3_jz6gek	Trump campaign cuts Sidney Powell from president’s legal team - The abrupt shake-up comes as Powell makes far-fetched and unsupported claims of voter fraud in the 2020 elections.	
t3_jz7lhm	Edward Norton tears into 'whiny, sulky, petulant, Grinchy, vindictive' Donald Trump in pointed, poker-laced Twitter thread	
t3_jzrkeu	Michigan Certifies Election Results Showing Biden Victory	
t3_jz44h2	Bernie Sanders says GOP ‘has ceased to be a political party’ and is now a ‘cult’ in fiery rebuke of Trump fraud claims	
t3_jz9j48	Kasich: Republicans 'either in complete lockstep' or 'afraid' of Trump	
t3_jzr8aw	Michigan election board certifies Biden win	
t3_jzs7ix	G.M. Drops Its Support for Trump Climate Rollbacks and Aligns With Biden	
t3_jzreko	Michigan's state board certifies Biden's win	
t3_jzlcxd	Trump Could Push Don Jr. and Ivanka in 2024, but Trumpism Is a Hard Sell Without Him	
t3_jzphue	GOP senator, business leaders urge prompt Biden transition	
t3_jzseje	National Security Experts Urge Republicans To Demand Trump Concede The Election	
t3_jzt627	Michigan's Board Of State Canvassers Certified Biden's Win In A Big Loss For Trump's Desperate Bid To Overturn The Election	
t3_jzej98	Pennsylvania’s Lt. Gov. Trolls Trump, ‘Dopey’ GOP Lawsuits In Epic Tweetstorm	
t3_jztt46	“Let’s Buy Trump Off So He Shuts the F--k Up”: Will Rupert Murdoch Spring for a Post-Presidential Fox Gig?	
t3_jztfqa	Trump Wars II: The Loser Strikes Back	
t3_jzrtop	Bipartisan Michigan election board certifies Biden’s win on 154,000-vote margin	
t3_jz3tl3	Michael J. Fox says Donald Trump has played on 'every worst instinct in mankind': 'Biff is president!'	
t3_jzv6i4	‘Bye bye Trump’: Ilhan Omar and others celebrate as president finally begins transition	
t3_jzeqq0	Opinion | Why Biden should stop parsing words and call Trump's lies a coup	
t3_jzs5wi	Michigan board votes to certify the state’s election results, dealing Trump another blow	
t3_jzba0d	Carl Bernstein names 21 GOP senators who 'privately expressed their disdain' for Trump	
t3_jzlzl3	After looming so large in Washington, Donald Trump has shrunk into a small, petty man	
t3_jzszzy	Vladimir Putin wasted no time in weaponizing Trump's election conspiracies to spread Russian propaganda	
t3_jzp2ts	Joe Biden nominates first woman to lead intelligence and first Latino to head homeland security	
t3_jzcmj4	New Zealand leader Ardern offers virus know-how to Joe Biden | New Zealand Prime Minister Jacinda Ardern has become the latest world leader to congratulate President-elect Joe Biden on his election victory, saying she offered to share her nation’s expertise on dealing the coronavirus	
t3_jzsbmo	Michigan certifies Biden win; a setback for Trump challenge	
t3_jzsrxm	General Motors abandons Trump in lawsuit fighting California on its own climate rules and vows to work on crisis with Biden	
t3_jzqp20	Trump-Appointed Judges Find Conversion Therapy Bans Unconstitutional	
t3_jzri76	Michigan board of state canvassers certifies results of November 3 U.S. presidential election for Democrat Biden	
t3_jzt9d7	Trump’s Legal Team Tries (and Fails) to Disavow Conspiracy Theorist Attorney Sidney Powell: Unfortunately for Rudy Giuliani, Jenna Ellis, and the GOP, it’s not so easy to un-release The Kraken	
t3_jzpvd8	Trump's bizarro-world 'elite strike force' legal challenge is about to implode	
t3_jzucjw	President-elect Biden reveals six key foreign policy and national security appointments	
t3_jzssf1	Leaders react after board certifies President-elect Joe Biden’s win in Michigan	
t3_jzoam2	Reality Forecloses on the Trump Presidency | A fading campaign collapses under the weight of finally having to back up big talk with actual substance.	
t3_jzuuec	Biden team wants to understand Trump effort to 'hollow out government agencies'	
t3_jztko1	Biden's latest appointment, John Kerry, signals how the new administration will handle the climate crisis	
t3_jzt3hn	Drip by drip, U.S. Republicans edge away from Trump election claims	
t3_jzk79i	Former GOP Ohio Governor Says Republicans Are Either ‘Afraid’ or ‘in Complete Lockstep’ With Trump	
t3_jztpkn	Biden's national security team 'represents the diversity of America'	
t3_jzr9x7	Michigan election board certifies 154,000-vote victory for Joe Biden, another setback in Trump’s effort to overturn election results	
t3_jz1z65	‘Stop golfing and concede’: Trump and Maryland Gov. Hogan spar again after president criticizes South Korean tests	
t3_jzup21	Biden signals sharp shift from Trump with Cabinet picks	
t3_jz227v	GOP Senator Has Instructed Staff to Cooperate With Biden Transition, Says It's 'Past Time' for Trump to Do Same	
t3_jzr85t	Michigan election board votes to certify Biden win, dealing blow to Trump effort	
t3_jzr751	Michigan board votes to certify the state’s election results, dealing Trump another blow	
t3_jzr6vb	Michigan's Board Of Canvassers Certified Biden's Win In A Big Loss For Trump's Desperate Bid To Overturn The Election	
t3_jzrl06	Chris Christie calls Trump's legal team a 'national embarrassment'	
t3_jziwyr	What if Trump won’t leave the White House? A hostage negotiator, an animal-control officer, and a toddler whisperer have advice	
t3_jz2pba	Small but growing number of Republicans tell Trump it’s over: “Stop golfing and concede”	
t3_jzhlu7	Trump's 'elite, strike force' legal team starts to shrink	
t3_jzfnsj	Biden to spotlight CDC officials shunned by Trump	
t3_jzr6u0	Michigan Certifies Joe Biden's Election Victory	
t3_jzpuu9	Election officials are facing death threats in key swing states where Trump is trying to overturn the results of the 2020 presidential race	
t3_jzr4ue	Michigan Election Board Certifies Victory for Biden	
t3_jzd94c	Carl Bernstein Names Names: 21 GOP Senators Who've Privately Ripped Trump	
t3_jz0akg	Trump, GOP’s ridiculous, flailing coup isn’t a joke. It’s a crime. There must be consequences | Will Bunch	
t3_jzo8pn	GM flips to California's side in pollution fight with Trump	
t3_jzn3cr	Biden Taps John Kerry For New National Security Role Focused On The Climate Crisis	
t3_jzrj8r	Michigan's state board certifies Biden's win	
t3_jzruwz	General Motors’ parting shot at Trump bodes well for the Biden presidency	
t3_jzogjj	John Kerry to join Biden administration as National Security Council official dedicated to climate change	
t3_jzopkn	Biden taps Alejandro Mayorkas as first immigrant to lead Homeland Security	
t3_jzn4mo	Despite Trump’s prod, Mich. to consider certifying Biden win	
t3_jzta4e	Trump Administration To Start Transition Process For Biden	
t3_jzqpbm	Rush Limbaugh criticizes Trump legal team for promising 'bombshells' and failing to deliver	
t3_jzti5c	GSA Sends Letter to Biden Making Resources Available for Transition	
t3_jzms1q	Pro-Trump Attorney Lin Wood Urges Republicans Not To Vote In Georgia Senate Runoff -- Unless GOP candidates help overturn the presidential election results in the state.	
t3_jzu0rh	Rush Limbaugh On Trump’s Legal Team: ‘They Promised Blockbuster Stuff And Then Nothing Happened’	
t3_jzua12	GSA notifies Joe Biden that Trump administration is ready to start transition process	
t3_jzlwxs	Bombshell: Biden takes min 98% of a 23,487 vote batch at 12:18AM in GA	
t3_jzfqzc	"Do Trump-Supporters Live in an Alternate Universe? Actually a huge number of Americans have a false impression of reality because they are being told lies by their media. The people who constantly hear these lies do live in an ""alternate reality."""	
t3_jzu8wb	Trump accepts transition to Biden can begin	
t3_jzjbne	Sidney Powell Confirms Non-Affiliation With Trump Legal Team, Vows to Continue Fraud Fight	
t3_jznypc	Trump campaign takes Pennsylvania election fight to federal appeals court	
t3_jzud9p	Bernstein names 21 Republican senators who privately expressed contempt for Trump	
t3_jzk9j0	"Sidney Powell Responds to Trump Campaign's Statement Saying She's Not Part of Legal Team -- Powell said her fight will go on anyway and closed her statement with the hashtag, ""#KrakenOnSteroids"""	
t3_jzpd7w	JUST IN: Third Circuit Court of Appeals Grants Expedited Review For Team Trump’s Appeal in Pennsylvania	
t3_jzjzln	A Neighbor You Like Probably Voted For Trump	
t3_jzuvjc	Trump Administration Begins Transition Process	
t3_jzqca2	Trump scores two wins as Michigan legislature, federal appeals court agree to election reviews	
t3_jz7p9d	In Apparent Glitch, Voting Machines Hunt Down And Murder Trump Supporters	
t3_jz5rv6	Trump campaign says Sidney Powell not a member of legal team	
t3_jzjptq	Two-thirds of GOP voters support Trump running for president in 2024: survey	
t3_jzitza	Why The Left Can Be So Ridiculously Self-Righteous Without Realizing It -- What we saw in the lead up to the elections, and what we’ll witness for years to come, is utter contempt for Trump voters and conservatives in general.	
t3_jznr0d	Appeals Court Grants Expedited Review of Trump Campaign's Pennsylvania Lawsuit	
t3_jzloh0	Watergate journalist Carl Bernstein outs 21 Republican senators who 'privately' expressed 'extreme contempt' for Trump.	
t3_jzjlmh	Democrat House Losses Stemmed From Trump Increasing Voter Turnout: Rep. Richmond	
t3_jzo4tp	Journalist Carl Bernstein names 21 GOP senators who 'privately expressed their disdain' for Trump	
t3_jzpdpe	Trump's election lawsuit leads to 3rd Circuit grant for expedited review	
t3_jzn4sl	Biden proposes John Poulos, CEO and President of Dominion Voting Systems, as Surgeon General and Head of Covid Analytics. Dominion will now be solely in charge of recording and keeping an exact count of what has become the most deadly virus in the history of the world.	
t3_jzpzzc	Janet Yellen Is Biden’s Pick for Treasury Secretary	
t3_jzmj9c	Political Enemy List Trump Accountability Project Publicly Posted on Their Website	
t3_jzq15s	Rush Limbaugh: Trump Needs to Hold Rallies in Georgia	
t3_jzi0vw	5 More Ways Joe Biden Magically Outperformed Election Norms	
t3_jzijpr	Trump Pulls Out Of Military Transparency Treaty With Russia, Europe	
t3_jzrhs0	Biden's Treasury Secretary: Janet Yellen	
t3_jzntsc	GOP Former National Security Officials Urge Party to Demand Trump Concession	
t3_jzi8g6	Trump’s legal team’s statement on Sydney Powell was made to focus on the upcoming Supreme Court case. There are two separate legal pathways. One on equal protection and PA voting rules (most important right now). The second is Dominion software which will take longer.	
t3_jz9dqx	Lou Dobbs Warns the GOP: Republican Party ‘Will Be Gone and Done’ If They Don’t Stand With President Trump	
t3_jzl6re	5 More Ways Joe Biden Magically Outperformed Election Norms	
t3_jzv44u	Trump Supporter Charged with Simple Assault for Breathing on Protesters	
t3_jzqyu6	Joel Kotkin: The Green End Game Runs Through Biden	
t3_jzjgop	Open Letter Calls on Harvard to Create 'System of Accountability' for Inviting Trump Admin Alums to Campus	
t3_jzmy0e	'Joe Biden is a very weak President, could start wars': Chinese government advisor | World News - Times of India	
t3_jz2tha	Trump obsession: Democrats tweet about him 12,569 times to 486 about Biden	
t3_jzvcjq	Biden's national security adviser pick played key role in Clinton email scandal	
t3_jzkul5	Trump: More Votes Than Voters in Key Swing States	
t3_jyzq16	Putin Says He’s Not Ready to Recognize Biden as U.S. President	
t3_jyzpvt	"How Trump Responded When Liz Cheney Called on Him to Concede: ""Sorry Liz, can’t accept the results of an election with hundreds of thousands of fraudulent votes cast, enough to easily flip the Election. You’re just unhappy that I’m bringing the troops back home where they belong!"""	
t3_jzo3u5	Obama's third term: Biden reveals first cabinet picks	
t3_jzbqm7	Trump campaign demands recount, signature matching in Georgia	
t3_jz7frn	Trump Campaign Formally Requests a Recount in Georgia	
t3_jzu0lg	Walter Mead: Biden’s Foreign-Policy Team Takes Shape	
t3_jzkxnl	Professor causes uproar asking Biden voters to unfriend him	
t3_jz5fzn	Federal judge dismisses Trump campaign’s Pennsylvania case	
t3_jzmvum	Appeals Court Grants Expedited Review of Trump Campaign's Pennsylvania Lawsuit	
t3_jzhelc	Mike Flynn Jr. adds twist to Trump team’s statement on Sidney Powell: ‘Give this the 24hr rule …’	
t3_jzverf	Trump’s Case is a Constitutional One, Sidney Powell's is a Criminal One	
t3_jzv491	Reince Priebus reacts to Wis. Dems' rule-change try following Trump recount filing: ‘You can’t make this up!'	
t3_jyvpw5	BREAKING: FDA Grants Emergency Use Authorization To Antibody Cocktail Used By Trump	
t3_jyxl1z	How to explain Latino support for Trump? ABC News reports misleading memes went viral in Latino communities	
t3_jzq2wb	Sidney Powell responds to Trump Campaign legal statement with agreement but an “epic” lawsuit is still coming this week	
t3_jz5f71	Julie Burchill: President Trump has loved and been great for Israel	
t3_jyymh1	Reap What You Sow: Media Who Coddled Biden for Months Now Complain About Mistreatment	
t3_jz447i	"Omar Urges Biden To Reverse Trump's Agreements In The Middle East And Claims They Were ""Not Peace Deals"""	
t3_jywg7k	Devout Catholic Joe Biden, our most pro-abortion president	
t3_jyz99e	Trump Lawyer Sidney Powell Promises 'Biblical' Lawsuit in Coming Days	
t3_jz3j9r	BLM Founders Demand Joe Biden Support A 'Roadmap' To Abolition Of Police, Prisons	
t3_jz37gc	Trump Derangement Syndrome in Democrats won't go away with Trump	
t3_jywdz5	Philly Bans All Indoor Gatherings Unless You're Still Counting Biden Votes	
t3_jyunuj	"Trump campaign adviser Steve Cortes: Sudden Stop In Mail-In Vote Count 'Suspicious' -- Particularly since it was followed by a ""deluge"" of votes for Joe Biden in key battleground states."	
t3_jyulqn	Trump Team Files for Fresh Recount in Georgia’s Presidential Race	
t3_jylbj0	CNN Condemns Trump Rallies As 'Physically Peaceful But Morally Violent'	
t3_jz60sj	Dominion responds to Trump team claims	
t3_jznsl5	Biden secretary of state pick Blinken criticized over Iraq War, consulting work	
t3_jz56nz	GOP senator says Trump to Biden transition should begin 'tomorrow morning'	
t3_jyxyyy	China Issues Instructions for ‘Incoming Biden Administration’	
t3_jyjte3	Ilhan Omar Urges Biden to ‘Reverse’ President Trump’s Middle East Agreements -- Thinks that peace between Israel and Arab nations is a bad thing.	
t3_jz7fr3	Latest: Why a Federal Judge Tossed Out One of the Trump Campaign's PA Lawsuits	
t3_jzaqqe	An statement from Senator Toomey regarding the Pennyslvania Federal Court decision regarding the Trump campaign lawsuit.	
t3_jyl85p	Judge Dismisses Trump Campaign Suit to Invalidate PA Election Certification With Prejudice	
t3_jyqh97	Chinese Warn Against Communism at Trump Rally, Tell Americans to Speak Out	
t3_jylfat	Hispanic Voters In Florida Who Fled Dictatorships Think The Election Was Stolen From Trump	
t3_jzaje9	Scranton dedicates 'Joe Biden Way' to honor president-elect	
t3_jz3bhq	Pennsylvania election: Trump appeals dismissal of bid to block vote certification	
t3_jzhbcz	The Death Star Strategy: Is Trump Contemplating The Ultimate Constitutional Trick Shot?	
t3_jyztx6	Do Trump Supporters Live in an Alternate Universe?	
t3_jzsxow	Trump Lawyer: Michigan Legislature Agrees to Hold Election Review Hearings	
t3_jzrh4s	Hours After Biden Picks Blinken For Secretary Of State – His Closet Door Swings Open On Iraq And Consulting	
t3_jzu5h2	The Socio-Political Legacy 0f Trump	
t3_jzrc5e	Rep. Nunes Worried Biden Will Shut Down Durham Investigation	
t3_jyp5q9	Actor Scott Baio threatens to move to Utah to unseat Sen. Mitt Romney after his anti-Trump tweet	
t3_jym9cn	Pennsylvania Judge Dismisses Trump Campaign's Challenge to Pennsylvania Election Law	
t3_jyusgt	Ben Carson: Trump Saved My Life After I Got COVID	
t3_jztzoa	The mullah report: is Biden bringing back the Iran Deal? | Spectator USA	
t3_jykyw7	Federal Election Commission Chair: Trump Campaign Has Legitimate Claims of Election Fraud	
t3_jztwv2	Revolving Door: Obama Staffers Who Joined NBC, MSNBC, and CNN, Now Headed to Biden Admin	
t3_jzt2hb	Data: Trump's Anti-Globalism, Pro-Police Message Wins Over Hispanics	
t3_jznbrr	U.S. Election: Trump legal team distances itself from lawyer after controversial comments - National | Globalnews.ca	
