Name	title	coding
t3_jyljff	Joy Reid: It looks like Republicans 'want to hand Biden mega crises' and a country that's broken	
t3_jz81tt	Trump lashes out at fellow Republicans as his legal challenges to election results fail	
t3_jyxodl	U.S. courts find no voter fraud despite cries from Trump’s legal team	
t3_jz3ygy	Refusing to concede, Trump pushes for another recount in Georgia	
t3_jytj5f	Trump or No Trump, Religious Authoritarianism Is Here to Stay	
t3_jz8gig	Man seen exhaling on women outside Trump golf club charged	
t3_jz3bwt	Against Returning to Normal | Joe Biden positioned himself as the “return to normalcy” candidate. But normalcy is not something we can afford—we must actively resist it.	
t3_jyjecp	Wisconsin officials: Trump observers obstructing recount	
t3_jyz8b3	For U.S. election officials certifying results, Trump's refusal to concede has chilling consequences	
t3_jyuofr	Judge rules against Trump global media chief after firings | A federal judge has ruled against the head of the agency that runs the Voice of America and other U.S.-funded news outlets who was accused of trying to turn it into a propaganda vehicle to promote President Donald Trump’s agenda	
t3_jz5d4v	A Few More Hill GOPers Push Trump To Accept Reality As More Legal Battles Fall Flat	
t3_jyzx05	Latino Democrats tell Mexican president to get with the program and back Biden	
t3_jyzfzs	Chris Christie Says Trump's Legal Team Has Become a 'National Embarrassment'	
t3_jz1j6s	Missing links: Trump goes golfing in middle of G20 summit	
t3_jz7kyq	Democrats expect Biden to name Linda Thomas-Greenfield UN ambassador	
t3_jz5ffr	Trump campaign says Sidney Powell not a member of legal team	
t3_jyj5z6	Detroit voters sue Donald Trump over unsubstantiated claims of voter fraud	
t3_jyxu4b	Biden advisor: 'He does not have any concern' about Trump lawsuits	
t3_jyy8fq	Biden to name first Cabinet picks Tuesday, as Trump bemoans swift actions	
t3_jyy5dt	Facebook, Instagram Will Switch White House Accounts From Trump to Biden on Jan. 20	
t3_jymfwh	Wisconsin election officials say Trump observers obstructing recount, some ‘clearly don’t know what they are doing’	
t3_jyvps6	Judge's devastating question for team Trump	
t3_jyk8mk	‘My Frustration Turned Into Anger.’ Some Americans Who Lost Family Members to COVID-19 Have Turned Against Donald Trump	
t3_jyyy5l	Biden inauguration will be scaled down amid COVID, aide says	
t3_jyn1nu	'Absolutely shameful': Schiff condemns Trump's golf outing	
t3_jz003m	Chris Christie calls Trump's legal team a 'national embarrassment'	
t3_jz0elw	President-elect Joe Biden to announce Cabinet picks Tuesday	
t3_jyi4xi	Impeach the president again — Removal from office wouldn’t be the goal this time. It would be to prevent Trump from running again.	
t3_jyhv9o	Trump was pictured on his Virginia golf course during a coronavirus meeting for G20 leaders	
t3_jz071b	‘National Embarrassment’: Christie Blasts Trump’s Legal Team As Election Challenges Fizzle	
t3_jz2hjq	Trump team making false argument about his 2016 transition	
t3_jyxvfq	Biden chief of staff says inauguration ‘not going to be the same’	
t3_jz7cd3	Trump’s campaign vows to appeal Pennsylvania lawsuit all the way to Supreme Court	
t3_jz65om	Barack Obama on a Biden presidency, racism in the Trump era and what he misses about being president	
t3_jz5qol	Biden Plans to Move Fast With a ‘Climate Administration.’ Here’s How.	
t3_jyy0a9	Trump election challenges sound alarm among voters of color	
t3_jyvhg1	Biden hits Trump for refusing to concede, says 'national mask mandate' discussed with govs	
t3_jz68im	Why a federal judge threw out Trump's Pennsylvania election lawsuit	
t3_jyih12	Yes, Trump Is (Still) Engaged in an Attempted Coup; and Yes, It Might Lead to a Constitutional Crisis and a Breaking Point	
t3_jz7vxc	Biden to unveil first Cabinet picks on Tuesday, envisions scaled-down inauguration	
t3_jz6dv5	Women set to take key roles in Biden administration	
t3_jywlx5	Biden's first Cabinet picks coming Tuesday, chief of staff Klain says	
t3_jyo5jb	Pa. Sen. Toomey congratulates President-elect Joe Biden, calls on Trump to begin transition	
t3_jz0b53	Trump tells G-20 world leaders that Paris climate accord was 'designed to kill the American economy'	
t3_jz2622	Trump’s overarching Middle East strategy reaches a disastrous dead end	
t3_jz0az8	Pennsylvania GOP Sen. Toomey Says Trump Should Accept Election Loss	
t3_jz3cid	Can Republicans Get Trump-Style Turnout Without Trump on the Ballot?	
t3_jz055a	Rep. Jeffries: Trump is in a massive meltdown right now	
t3_jyjnr1	Trump Campaign Lawyers File New Pennsylvania Motion Which Misspells Governor’s Name	
t3_jz3tv7	Ronna McDaniel has reportedly warned Donald Trump Jr., Kimberly Guilfoyle could succeed her as RNC chair	
t3_jz3bgw	Louis: Biden transition news is now the top priority	
t3_jymexa	RNC Backs Trump's Bogus Claims That He Won the Election	
t3_jyrw5r	Why President-elect Joe Biden should cancel the inaugural balls during COVID	
t3_jz2ux2	#Resist was a success, in looking back at Trump's presidency	
t3_jyp99g	Biden Says Containing Pandemic Is Vital to Economic Recovery	
t3_jz7wz1	Biden to Name Longtime Aide Blinken as Secretary of State	
t3_jz8dam	Biden Chooses Antony Blinken, Defender of Global Alliances, as Secretary of State	
t3_jz81lx	Biden plans to name Blinken secretary of state: Bloomberg	
t3_jz3r4j	Trump appeals rejection of effort to block Pennsylvania vote	
t3_jyufz5	‘Something very historical’: Native Americans push for diverse Biden Cabinet	
t3_jyomso	GOP senator congratulates Biden, says Trump should accept results	
t3_jyg71f	NAACP Federal Suit: Trump Violated Voting Rights Act	
t3_jyzg9r	Rudy Giuliani says election case losses help Trump campaign’s strategy to get ‘expeditiously’ to Supreme Court	
t3_jz2d5u	Ronna McDaniel has reportedly warned Donald Trump Jr., Kimberly Guilfoyle could succeed her as RNC chair	
t3_jyp41a	Wisconsin election officials say Trump observers are obstructing the recount and interrupting vote counters	
t3_jyfn88	Trump tweets about election results and skips session on pandemic during G20	
t3_jz38b8	In Wisconsin recount, Trump challenges pile up, slow tally	
t3_jyn72v	"""Joe Biden Way"" sign unveiled in Scranton"	
t3_jyevov	Trump Supporters in Georgia Threaten to Destroy GOP, Boycott Runoff Elections	
t3_jz3we3	The ‘last voice in the room.’ What will Kamala Harris do as Joe Biden’s vice president?	
t3_jyu2fl	The federal toll of Trump's failure to lead	
t3_jz1lvu	Trump seeks expedited appeal of Pennsylvania ruling against effort to toss mail-in ballots	
t3_jyjcxb	Wisconsin officials: Trump observers obstructing recount	
t3_jz5hlr	Chris Christie rips Trump's legal team as ‘national embarrassment’	
t3_jyym78	Biden will announce first Cabinet picks on Tuesday, chief of staff Klain says	
t3_jyebbg	GOP asks Michigan not to certify election results, citing ‘irregularities’ | The move follows speculation that Trump is seeking to persuade Michigan Republicans to override election results	
t3_jz866v	Get Me Meacham! Biden Brings Back the Media’s Good Old Days	
t3_jyv7ng	Spy Jonathan Pollard expected to fly to Israel after US lifts parole. Release marks latest gesture by departing Trump administration towards the Israeli government	
t3_jyoq50	Trump calls on GOP state legislatures to overturn election results	
t3_jz8l93	Top Biden adviser seen as making tech regulation more likely	
t3_jz7uqg	Joe Biden’s first Cabinet picks expected Tuesday amid Trump's road blocks to transition	
t3_jz5rv6	Trump campaign says Sidney Powell not a member of legal team	
t3_jz2tha	Trump obsession: Democrats tweet about him 12,569 times to 486 about Biden	
t3_jyzq16	Putin Says He’s Not Ready to Recognize Biden as U.S. President	
t3_jyzpvt	"How Trump Responded When Liz Cheney Called on Him to Concede: ""Sorry Liz, can’t accept the results of an election with hundreds of thousands of fraudulent votes cast, enough to easily flip the Election. You’re just unhappy that I’m bringing the troops back home where they belong!"""	
t3_jz63x3	Trump campaign says Sidney Powell isn't a member of its legal team	
t3_jz7p9d	In Apparent Glitch, Voting Machines Hunt Down And Murder Trump Supporters	
t3_jyvpw5	BREAKING: FDA Grants Emergency Use Authorization To Antibody Cocktail Used By Trump	
t3_jyxl1z	How to explain Latino support for Trump? ABC News reports misleading memes went viral in Latino communities	
t3_jyymh1	Reap What You Sow: Media Who Coddled Biden for Months Now Complain About Mistreatment	
t3_jz7frn	Trump Campaign Formally Requests a Recount in Georgia	
t3_jz5fzn	Federal judge dismisses Trump campaign’s Pennsylvania case	
t3_jz6olk	Sidney Powell No Longer Part of Trump's Legal Team: Giuliani Statement	
t3_jywg7k	Devout Catholic Joe Biden, our most pro-abortion president	
t3_jz5h7b	Young voters set turnout record, aiding Biden	
t3_jyz99e	Trump Lawyer Sidney Powell Promises 'Biblical' Lawsuit in Coming Days	
t3_jz37gc	Trump Derangement Syndrome in Democrats won't go away with Trump	
t3_jz447i	"Omar Urges Biden To Reverse Trump's Agreements In The Middle East And Claims They Were ""Not Peace Deals"""	
t3_jylbj0	CNN Condemns Trump Rallies As 'Physically Peaceful But Morally Violent'	
t3_jyunuj	"Trump campaign adviser Steve Cortes: Sudden Stop In Mail-In Vote Count 'Suspicious' -- Particularly since it was followed by a ""deluge"" of votes for Joe Biden in key battleground states."	
t3_jywdz5	Philly Bans All Indoor Gatherings Unless You're Still Counting Biden Votes	
t3_jz5f71	Julie Burchill: President Trump has loved and been great for Israel	
t3_jyulqn	Trump Team Files for Fresh Recount in Georgia’s Presidential Race	
t3_jz60sj	Dominion responds to Trump team claims	
t3_jz56nz	GOP senator says Trump to Biden transition should begin 'tomorrow morning'	
t3_jyjte3	Ilhan Omar Urges Biden to ‘Reverse’ President Trump’s Middle East Agreements -- Thinks that peace between Israel and Arab nations is a bad thing.	
t3_jz3j9r	BLM Founders Demand Joe Biden Support A 'Roadmap' To Abolition Of Police, Prisons	
t3_jyxyyy	China Issues Instructions for ‘Incoming Biden Administration’	
t3_jyl85p	Judge Dismisses Trump Campaign Suit to Invalidate PA Election Certification With Prejudice	
t3_jz6rre	"Joseph Nye: ""Trump deserves credit for pushing back on China's abusive trade practices, but it would have been better if we worked with our allies to isolate China. Also, his trade deal has been costly for Americans without changing the trade imbalance or addressing technological issues."""	
t3_jyqh97	Chinese Warn Against Communism at Trump Rally, Tell Americans to Speak Out	
t3_jylfat	Hispanic Voters In Florida Who Fled Dictatorships Think The Election Was Stolen From Trump	
t3_jz3bhq	Pennsylvania election: Trump appeals dismissal of bid to block vote certification	
t3_jz7fr3	Latest: Why a Federal Judge Tossed Out One of the Trump Campaign's PA Lawsuits	
t3_jyztx6	Do Trump Supporters Live in an Alternate Universe?	
t3_jyp5q9	Actor Scott Baio threatens to move to Utah to unseat Sen. Mitt Romney after his anti-Trump tweet	
t3_jym9cn	Pennsylvania Judge Dismisses Trump Campaign's Challenge to Pennsylvania Election Law	
t3_jyusgt	Ben Carson: Trump Saved My Life After I Got COVID	
t3_jykyw7	Federal Election Commission Chair: Trump Campaign Has Legitimate Claims of Election Fraud	
t3_jz421o	It begins: The Biden border surge, and too bad about the COVID lockdowns	
t3_jynp3x	Trump Orders Hasty Afghanistan, Iraq Drawdowns to Beat Biden Inauguration	
t3_jyuhux	Trump campaign attorney responds to Pennsylvania ruling &amp; they’re grateful	
t3_jymov0	Trump Warns 'Massive Fraud' to Be Uncovered in Michigan Vote	
t3_jz1z44	Top House conservative plots post-Trump GOP	
t3_jygwhl	Donald Trump Improved Standing With Latinos In 78 Of America’s 100 Majority-Hispanic Counties	
t3_jypb2u	Philly Bans All Indoor Gatherings Unless You're Still Counting Biden Votes	
t3_jysta7	Trump camp's lawsuit struck down in Pennsylvania	
t3_jytpjk	Pa. Senator Pat Toomey Says President Trump Has 'Exhausted All Plausible Legal Options'	
t3_jyp7pw	Judge Dismisses Trump Campaign’s Pennsylvania Lawsuit, Slams ‘Strained’ Reasoning; This only helps these cases reach higher levels of court because signed affidavits are admissible in court	
t3_jz1up7	Trump Lawyer Says New Lawsuits Will Be Filed in Georgia Soon: 'Quite a Shock'	
t3_jyby0o	Trump Announces Groundbreaking Rules to Lower Prescription Drug Prices	
t3_jyr204	Trump campaign files for new recount in Georgia	
t3_jynua5	Release: Toomey Statement on PA Federal Court Decision, Congratulates President-elect Biden | U.S. Senator Pat Toomey of Pennsylvania	
t3_jyoy6m	Biden to ‘Racist’ Trump Voters: ‘Let’s Heal.’ That’s Easy for Him to Say.	
t3_jypjqa	Merkel's Germany Tells Trump Not to Bring Troops Home from Afghanistan	
t3_jyqoj0	Dr. Ben Carson: Trump Saved My Life After I Got COVID	
t3_jytan4	Detroit voters sue President Trump over his attempt to block certification of election results	
t3_jz8s6s	"Mail in ballots come in envelopes. They have creases. ""Ga Poll Worker Describes Pristine Mail In Ballots, 98% for Biden"""	
t3_jyv0um	FDA Grants Emergency Use Authorization To Antibody Cocktail Used By Trump	
t3_jykt0d	Michigan AG Suggests Criminally Charging Republican Legislators for Meeting With Trump	
t3_jyaufj	Berkeley professor sparks outrage by claiming Trump supporters who have an 'indifference' to COVID are like Germans who 'ignored and profited from the Holocaust'	
t3_jyobi4	Michigan Legislators Face Calls For Possible Criminal Charges After Meeting With President Trump On Certification	
t3_jyn4xj	Trump campaign statement on Pennsylvania ruling	
t3_jyp3ti	Trump Lawyers: Pennsylvania Lawsuit Dismissal Moves Us Closer to Supreme Court	
t3_jysprc	FDA Grants Emergency Use Authorization To Antibody Cocktail Used By Trump	
t3_jyhhtr	McEnany: Trump's path to victory is Supreme Court, exposing 'systemic' voter fraud	
t3_jydj00	LIVE: March for Trump in Atlanta, Georgia	
t3_jydzd2	Twitter says it will hand control of US president's official account to Joe Biden on January 20 - regardless of whether Donald Trump has left the White House	
t3_jygs96	Merkel's Germany Tells Trump Not to Bring Troops Home from Afghanistan	
t3_jyfij4	Georgia Gov. Kemp Calls for Audit, Says Trump Can Demand New Recount	
t3_jy56dt	Trump Announces New Regulations Lowering Prescription Drug Costs	
t3_jykdwj	Twitter Plans To Hand @POTUS Handle Over To Biden On Jan. 20 No Matter What	
t3_jybrmo	Joe Biden's 'Vote Joe' website defaced by Turkish Hackers	
t3_jyqipn	Time is just not on Trump’s side to overturn 2020 election results	
t3_jy9egu	Joe Biden loses it at reporter who asked about kids going back to classrooms - then tells press to leave	
t3_jygoog	Trump voters back the President’s charges of election fraud led by Democrats	
t3_jy248u	Anti-Trump Legal Team Withdraws In Pennsylvania	
t3_jy8qby	Joe Biden: Why Are Reporters Asking Me Questions? On Friday, Biden appeared dumbfounded as to why a reporter was asking the projected Democratic presidential-elect a question as the press pool was being scurried away by staff.	
t3_jy4x55	Harvard Students Demand That Trump Officials Be Preemptively Barred From Campus	
t3_jyhsxr	Brian Williams mocks Geraldo Rivera suggestion to name COVID-19 vaccine after Trump	
t3_jybfam	BLM, Squad members pushing Dems, Biden to abolish prison	
t3_jy2icm	Donald Trump Jr. tests positive for COVID-19	
t3_jyb4tl	6 Big Claims by Trump’s Lawyers About Overturning Election Results	
t3_jybaah	Rudy and Sidney’s Krakentastic Spectacle, and What It Could Mean -- A dismissive legacy media might have panned Team Trump’s press conference Thursday, but it was a significant moment with significant portents.	
t3_jygabf	Ilhan Omar Urges Biden To ‘Reverse’ President Trump’s Middle East Agreements	
t3_jy1csd	Hispanic Voters in Florida Feel Election Was Stolen from Trump	
t3_jz593p	'This Obama judge' is 'outrageous': Mark Levin blasts PA ruling dismissing Trump voter fraud challenge	
t3_jz0c9x	Satire: CNN Condemns Trump Rallies As 'Physically Peaceful But Morally Violent'	
t3_jzr4dw	Michigan elections board certifies results from presidential election, sealing Biden’s win in state	
t3_jzo4ys	To Prevent 'Active Sabotage' of His Agenda, Biden Urged to Clean House of Trump Loyalists on Day One	
t3_jzmvi7	Trump's on his way out, but leaves a lasting legacy: The right's open embrace of terrorism. How did the Kenosha shooter post $2 million in bail? Because conservatives are normalizing right-wing terrorism	
t3_jzmb5h	Detroit had more vote errors in 2016 when Trump won Michigan by a narrow margin. He didn’t object then.	
t3_jzos3p	It’s Time To Consider Sanctions for Trump’s Legal Team	
t3_jznq3n	Clip of Ted Cruz Saying Democrats Would Say COVID 'Magically Better' Week After Biden Wins Resurfaces	
t3_jzonsl	Former Defense Secretary Jim Mattis says Biden should toss all of Trump's 'America First' policies	
t3_jzka2y	Pro-Trump Attorney Urges Republicans Not to Vote in Georgia Runoff	
t3_jzjwz1	100 Republican national security experts demand GOP admit Trump loss	
t3_jzpeei	Trump Is Blowing Up the Georgia GOP—and It Couldn’t Happen at a Better Time	
t3_jzj864	Business Leaders Tell GOP: Start Biden Transition or No Money for Georgia Senate Run-Offs	
t3_jziz6f	Trump will leave office soon. But we can’t let him escape accountability for his misdeeds.	
t3_jzm9x0	Biden picks John Kerry for climate envoy on national security council	
t3_jzgzo5	Trump is not just refusing to concede, he is sabotaging nation’s interest	
t3_jzpowr	Let’s hear it for the judges for dismissing Trump’s lawsuits	
t3_jzmtno	Tucker Carlson was attacked by Trump supporters for questioning the outlandish claims of the president's lawyer Sidney Powell before she was fired	
t3_jzj8y9	Republican pollster: Trump's false 'rigged' election claims may hurt GOP chances of keeping Senate	
t3_jzfuso	Trump team falsely claim he was not assisted in transition by Obama	
t3_jzicmc	How Ronald Reagan’s Racism Helped Pave the Way for Donald Trump’s	
t3_jzpllg	The Already Useless Trump Kids Are About to Get Even More So	
t3_jzkjrv	Biden team is reportedly pushing congressional Democrats to strike an immediate stimulus deal with Republicans to stave off renewed recession	
t3_jzmfmo	President Trump Wanted a Supreme Court Election Battle. His Current Appeal Simply Cannot Get Him There.	
t3_jzlc67	GOP Sen. Rob Portman says Biden transition funds should be released	
t3_jzgz98	John Kasich Stunned GOP Isn’t Defending Democracy Against Trump	
t3_jzg091	Biden is stealing the spotlight. Trump can't stand it.	
t3_jzlnvy	A major Trump donor’s company got a 3 percent government-backed pandemic loan. It sells title loans at a 350 percent annual rate.	
t3_jzpy16	On Trump, GOP's silence 'can't be excused and won't be forgiven' — For the first time, a corrupt US leader is trying to cling to power through autocratic means. Let history note who lacked the patriotism to speak up.	
t3_jzpvbh	Rush Limbaugh criticizes Trump legal team for promising 'bombshells' and failing to deliver	
t3_jzeymy	New Zealand PM offers COVID-19 help to U.S. President-elect Biden	
t3_jzj73m	Trump’s press secretary Kayleigh McEnany heckled in briefing: ‘When will you admit you lost?’	
t3_jzrwc2	Pennsylvania Supreme Court Kills Trump Bid to Disqualify Ballots	
t3_jzq2dw	Poll: Majority say Trump should concede	
t3_jzlqyf	GOP senator says Biden's vote lead 'has not changed,' urges country to 'move forward'	
t3_jzh7ew	Carl Bernstein names 21 Republican senators who have ‘privately’ expressed ‘extreme contempt’ for Trump	
t3_jzhuwc	New Zealand offers Biden tips on COVID-19 after successful response	
t3_jzny0i	Pennsylvania Republicans Voted Against Certifying Vote in County Trump Won by 22,000	
t3_jzskav	Pennsylvania Supreme Court Reverses One of Trump’s Only Post-Election Litigation Wins	
t3_jzgode	Trump axed campaign lawyer Sidney Powell was because 'she was too conspiratorial even for him'	
t3_jze8d0	Transition warning: Trump's mental illness is a growing danger	
t3_jzsk0y	Congress Has Every Right to Keep Investigating Trump After He’s Gone	
t3_jzqf5t	Republican Congressman Says GOP 'Embarrassing,' Calls on Party to 'Denounce' Trump's 'Conspiracy Theories'	
t3_jzsjjw	Over 100 CEOs threaten to cut off funds to Georgia GOP if Trump keeps blocking transition: report	
t3_jzr8dl	Michigan certifies Biden win despite Trump's GOP overtures	
t3_jztm0i	Trump Campaign’s Actual Argument in Appeals Court: We’re Only Trying to Disenfranchise 1.5 Million Voters, Not 6 Million Pennsylvanians	
t3_jzs0fi	Michigan Certifies Joe Biden's Election Victory	
t3_jzmam7	Trump's top election lawyer in Wisconsin says he and his wife voted illegally in the campaign's latest legal argument	
t3_jzhcb0	What if Trump never concedes? The Constitution will end his term, conservative lawyer John Yoo says	
t3_jzj1p6	Group of Black voters in Detroit suing President Trump, citing voting rights abuses &amp; disenfranchisement	
t3_jzmqas	Conservatives spread false claim Biden invented 'office' of the president-elect	
t3_jzrmc0	Trump’s Ridiculous, Sloppy Coup Attempt Just Face-Planted in Michigan	
t3_jzrlc7	Maine certifies Biden’s victory in the state’s election	
t3_jzjoc9	Republican former national security officials urge party to demand Trump concession	
t3_jzs4qi	Detroit had more vote errors in 2016 when Trump won Michigan by a narrow margin. He didn’t object then.	
t3_jzguka	Trump handing Taliban a victory on his way out, says former national security adviser H.R McMaster	
t3_jzsjpm	Trump is reportedly worried that his legal team is made up of 'fools that are making him look bad'	
t3_jzsr22	Michigan certifies election results, making Biden's win official	
t3_jzmus9	Donald Trump’s Bid to Steal the Election Hinges on a Shameless Homophobe Who Once Called Him a Lying, Idiotic Bully	
t3_jzb2zh	Twitter Afire After Trump Camp Breaks With Lawyer: Lasted ‘About Half A Scaramucci’ | “Sidney Powell should refuse to concede her position from Trump’s legal team,” one critic joked.	
t3_jztjh2	National Embarrassment Donald Trump Worried Lawyers Are Sullying His Pristine Reputation	
t3_jzgsx3	Trump legal team says Sidney Powell had no formal role, but record shows they loved her involvement	
t3_jzla7n	Michigan voters sue Trump for allegedly disenfranchising Black voters with election interference	
t3_jzqg3e	Trump campaign suffers new court loss in attempt to block Biden’s win in Pennsylvania	
t3_jzr77v	Michigan board votes to certify the state’s election results, dealing Trump another blow	
t3_jzis32	Carl Bernstein named 21 GOP senators who he said are enabling Trump's attempts to subvert US democracy by only criticizing him in private	
t3_jzu2rx	Michigan Certifies Election Results, Declaring Biden Winner In New Blow To Trump	
t3_jzbb0y	Reporter Carl Bernstein names 21 GOP senators who 'repeatedly expressed extreme contempt for Trump'	
t3_jzqk4b	Secret Service members asked about protecting soon-to-be-former president Trump full time in Florida: Sources | Agents in Trump's detail have been asked about relocating to West Palm Beach.	
t3_jztlp5	G.M. Drops Its Support for Trump Climate Rollbacks and Aligns With Biden	
t3_jzqzld	Trump campaign forces Georgia taxpayers to pay for second recount after first one confirms its loss. A hand recount of nearly 5 million votes confirmed Biden's win, but Team Trump wants to milk taxpayers even more	
t3_jzk7yg	A Federal Judge Rejected Trump's Ludicrous Pennsylvania Case With Pure Disdain	
t3_jzucnl	How Trump's tweets inadvertently mobilized hundreds of thousands suburban women against him	
t3_jzuphz	Trump goes out with a whimper and a tweet. It was always going to be that way	
t3_jzrye4	Michigan votes to certify Biden's win over Trump	
t3_jzuvas	Report of a 'souring' relationship between Trump and Giuliani	
t3_jzsruy	Rush Limbaugh Does Full 180, Blasts Sidney Powell After Team Trump Disavowed Her	
t3_jzr5yp	Michigan Certifies Joe Biden's Election Victory	
t3_jzlbdp	Trump friend and adviser Steve Schwarzman recognizes Biden as President-elect	
t3_jzm28z	Biden to nominate first Latino and immigrant to run Homeland Security	
t3_jzj1yp	Major business leaders reportedly signed a letter urging Trump to concede, and warn that 'our democracy grows weaker' the longer the presidential transition is delayed	
t3_jzlipn	Sidney Powell Stricken from Trump’s ‘Elite Strike Force’ Legal Team 8 Days After President Called Her ‘Wonderful’	
t3_jzis4d	Will Trump’s Accusers Finally Get Their Day In Court? | He soon will be unable to hide from the women suing him for defamation.	
t3_jz8bvm	Native American voters across Minnesota turned out to oust Trump - Vote totals were up around Red Lake, and 90% for Biden	
t3_jzs06l	Michigan certifies Joe Biden's win despite Trump's GOP overtures | The Board of State Canvassers, which has two Republicans and two Democrats, confirmed the results on a 3-0 vote with one abstention	
t3_jztkzj	Trump fears Giuliani, other lawyers in Biden vote challenge are 'fools that are making him look bad'	
t3_jzquzq	GOP senator: No indication of widespread voting irregularities, window for Trump challenges is 'closing'	
t3_jz828i	Yet another Georgia election official receives threats after state certifies Biden win	
t3_jzjbng	In Another Country This Would Be Called a Coup: Detroit NAACP Head on Trump Trying to Overturn Vote	
t3_jzn0c8	Biden taps John Kerry as Special Presidential Envoy for Climate, marking the first time the NSC will have an official dedicated to climate change	
t3_jz6vh9	"Murkowski tells Trump: ""It is time to begin the full and formal transition process"""	
t3_jzorhc	Trump fears Giuliani, other lawyers in Biden vote challenge are ‘fools that are making him look bad’	
