Name	title	coding
t3_jyjecp	Wisconsin officials: Trump observers obstructing recount	
t3_jyhv9o	Trump was pictured on his Virginia golf course during a coronavirus meeting for G20 leaders	
t3_jyj5z6	Detroit voters sue Donald Trump over unsubstantiated claims of voter fraud	
t3_jyi4xi	Impeach the president again — Removal from office wouldn’t be the goal this time. It would be to prevent Trump from running again.	
t3_jyih12	Yes, Trump Is (Still) Engaged in an Attempted Coup; and Yes, It Might Lead to a Constitutional Crisis and a Breaking Point	
t3_jyfn88	Trump tweets about election results and skips session on pandemic during G20	
t3_jyevov	Trump Supporters in Georgia Threaten to Destroy GOP, Boycott Runoff Elections	
t3_jyg71f	NAACP Federal Suit: Trump Violated Voting Rights Act	
t3_jyk8mk	‘My Frustration Turned Into Anger.’ Some Americans Who Lost Family Members to COVID-19 Have Turned Against Donald Trump	
t3_jyebbg	GOP asks Michigan not to certify election results, citing ‘irregularities’ | The move follows speculation that Trump is seeking to persuade Michigan Republicans to override election results	
t3_jyd4va	Trump admits Michigan Congressmen met to discuss coup	
t3_jydai0	Bypassing McConnell: Democrats push Biden to aggressively use executive power	
t3_jycwb6	Meet Pennsylvania’s anger translator, and Donald Trump’s worst nightmare	
t3_jybzw2	Trump Organization's consulting payments to Ivanka Trump are focus of NY tax probe	
t3_jyljff	Joy Reid: It looks like Republicans 'want to hand Biden mega crises' and a country that's broken	
t3_jybvym	Biden's lead over Trump surpasses 6M votes as more ballots are tallied	
t3_jyehxb	No, Venezuelan communists did not interfere in the election. Yes, Trump’s legal team claimed that.	
t3_jyjnr1	Trump Campaign Lawyers File New Pennsylvania Motion Which Misspells Governor’s Name	
t3_jyjcxb	Wisconsin officials: Trump observers obstructing recount	
t3_jyat09	Michigan group sues Trump campaign for alleged mass voter suppression	
t3_jygbaz	GOP Michigan ex-governor says state board will certify Biden winner over 'bully' Trump	
t3_jynfza	Ben Carson Confirms Trump’s Friends Get Better Coronavirus Treatments	
t3_jymfwh	Wisconsin election officials say Trump observers obstructing recount, some ‘clearly don’t know what they are doing’	
t3_jycgfg	Shame the Random, Unknown Government Officials Aiding Trump’s Coup Attempt	
t3_jyarxl	Neal Katyal: All of Trump’s criminal immunity expires in about 60 days	
t3_jyl6wx	"""Pathetic"": Geraldo Rivera mocked by TV anchors for suggesting ""The Trump"" as name for COVID vaccine"	
t3_jyegwu	Wall Street Journal Bails on Trump’s ‘Conspiracy Theory,’ Says Giuliani is Not a ‘Serious Practicing Attorney	
t3_jyacke	"Rudy Giuliani's quixotic frenzy has observers wondering if he may need Trump's protection | ""One explanation? He needs a pardon and he's trying to earn it,"" a CNN analyst says"	
t3_jybdm3	Trump Takes Another L: Michigan GOPers Say No To Election Steal	
t3_jyd46w	Trump has longstanding history of calling elections 'rigged' if he doesn’t like the results	
t3_jy9p0n	Trump's defeat by Joe Biden has triggered a huge wave of relief among the United States' European allies	
t3_jyno88	Pa. Senator Pat Toomey Says President Trump Has ‘Exhausted All Plausible Legal Options’	
t3_jyirvl	‘Do they just not care?’ Miami immigrants troubled by surge of Latino support for Trump	
t3_jyaacw	Kayleigh McEnany’s Latest Trump Lie Is Firmly Debunked In Viral Video	
t3_jy8q5v	NJ Democrat Calls for Rudy Giuliani, Other Trump Attorneys to be Disbarred	
t3_jyevyz	Biden's popular vote lead over Trump stretches to more than 6m	
t3_jyk59x	Wisconsin officials: Trump observers obstructing recount	
t3_jymexa	RNC Backs Trump's Bogus Claims That He Won the Election	
t3_jyi19h	Trump Is Staging a Comically Incompetent Coup — It would almost be possible to laugh at this debacle if the stakes weren’t so serious.	
t3_jyn1nu	'Absolutely shameful': Schiff condemns Trump's golf outing	
t3_jyhrl0	Trump skips G20 pandemic event to visit golf club as virus ravages US	
t3_jyftsx	Trump’s Pennsylvania Suit is ‘Incoherent Conspiracy,’ Voters Say	
t3_jyamtf	Barack Obama: ‘Donald Trump and I tell very different stories about America’	
t3_jykr5a	Wisconsin Officials: Trump Observers Obstructing Recount	
t3_jyj7a6	Michigan Democrats are taking a stand against Trump's campaign to steal the state's vote	
t3_jygnzl	A group of Michigan voters are suing the Trump campaign for disenfranchising Black voters, lawsuit alleges	
t3_jyk4r9	Liz Cheney: Trump should respect ‘the sanctity of our electoral process’	
t3_jynvr3	Detroit voters sue President Trump over his attempt to block certification of election results	
t3_jykgfn	Black Detroit voters sue Trump campaign over effort to invalidate election results	
t3_jynoak	Release: Toomey Statement on PA Federal Court Decision, Congratulates President-elect Biden	
t3_jyd52j	Twitter to Meet With Biden Transition Team on Transfer of Social Media Accounts From Trump Admin	
t3_jy93rj	Dear Trump supporters: Those who egg on the president now, given the damage he does to America, are truly reprehensible	
t3_jyc40v	With Trump sabotaging American democracy, the Russians don’t need to interfere	
t3_jybo0y	Yes, Donald Trump claimed fraud after the 2016 Iowa caucuses	
t3_jyn1np	GOP civil war inspired by Trump grips Georgia, threatens other states	
t3_jyn72v	"""Joe Biden Way"" sign unveiled in Scranton"	
t3_jynl0k	Trump Campaign Loses Pennsylvania Suit to Halt Certification	
t3_jyhdoi	Trump tweets undermine Michigan leaders; images show Chatfield drinking at Trump hotel	
t3_jyix42	Trump does not participate in G-20 event on global pandemic preparedness	
t3_jyhg8l	Trump appointed judges in Florida overturn ban on conversion therapy for minors	
t3_jyj74r	Judge bars Trump appointee from interfering in Voice of America	
t3_jya174	Judge slaps down Trump appointee who has sought to reshape Voice of America and related agencies	
t3_jyfjeg	Most GOP Senators Stay Mum on Trump's Efforts to Challenge Election, After Washington Post Contacted All 53 of Them	
t3_jynvlv	U.S. judge calls Trump claim challenging Biden win in Pennsylvania 'Frankenstein's monster'	
t3_jyobrs	On Parler, a pro-Trump call for Georgia runoff boycott threatens Mitch McConnell's plan to restrain Biden	
t3_jyk5l1	The Desperate Final Gasps of Team Trump’s Flailing ‘Mini-Coup’	
t3_jyfk0g	"Sen. Bernie Sanders: ""Thank God"" Joe Biden won the election"	
t3_jy9p2e	Steve Mnuchin Is Doing His Part to Sabotage the Biden Administration on His Way out the Door	
t3_jybnek	Trump tries to drum out GOP election officials who won’t play his games — Georgia Secretary of State Brad Raffensperger's family has received threats and he expects a primary challenge in 2022	
t3_jyo5jb	Pa. Sen. Toomey congratulates President-elect Joe Biden, calls on Trump to begin transition	
t3_jyhjr0	Trump skips G20 coronavirus meeting to play golf and tweet bogus election claims	
t3_jylkfc	Wisconsin officials: Trump observers obstructing recount	
t3_jyj43l	Michigan Group Sues Trump for Disenfranchising Black Voters	
t3_jyle31	'Certify the Results!': GOP Michigan Lawmakers Blasted for 'Legitimizing a Fascist Coup Attempt' by Meeting With Trump	
t3_jye7eu	"In 'Tremendous Rebuke' of Trump Appointee, Federal Judge Bars US Media Agency Head From Interfering in News Coverage | ""Michael Pack has repeatedly and intentionally violated the First Amendment rights of VOA journalists."""	
t3_jynjyq	Wisconsin officials: Trump observers obstructing recount	
t3_jyl6g3	Let Trump Off the Hook in the Name of Elusive Unity? Some Critics Say That Could Be a Big Mistake	
t3_jyh4cs	As world leaders meet to talk pandemic, Trump checks out and hits the links	
t3_jyefvb	Donald Trump says 'I won, by the way' and lashes out at Pfizer claiming it delayed news of the COVID-19 vaccine until after the election	
t3_jymptl	Wisconsin officials: Trump observers obstructing recount	
t3_jymnby	Biden Considering Lisa Monaco, Sally Yates For Attorney General	
t3_jyny1g	A Judge Demolished The Trump Campaign’s Effort To Undo Biden’s Win In Pennsylvania And Push Fraud Conspiracies	
t3_jyl5yg	Donald Trump Is Leaving Behind Blueprints to End Democracy - And I fear there’s no going back	
t3_jyiofw	Sen. Graham says Biden should have access to classified intelligence briefings	
t3_jyg34p	Trump Using Last Days to Lock in Policies and Make Biden’s Task More Difficult	
t3_jyi47r	Trump Skips G20 Pandemic Preparedness Meeting as Covid-19 Cases Surpass 12 Million in US	
t3_jyoi1n	"""Trump has exhausted all plausible legal options"": GOP Sen. Pat Toomey congratulates Biden"	
t3_jyhqa5	Trump’s failure to work with Biden is becoming more urgent as Covid spreads	
t3_jyo1za	Donald Trump appears to admit Covid is 'running wild' in the US	
t3_jyktn9	Trump playing Golf instead of cooperating to fight the Coronavirus Pandemic	
t3_jy9asn	Let's count the ways Donald Trump has tried to subvert this election, shall we?	
t3_jygs2r	G20 leaders meet to discuss help for poorest nations in post-Covid world, Trump golfs	
t3_jynndi	Missing Links: Trump Goes Golfing In Middle Of G20 Summit	
t3_jybv6o	Will Trump Screw Up Republican Efforts to Hang Onto the Senate?	
t3_jyjt9q	Battered by failures to reverse Biden win, Trump, allies persist with fraud claims	
t3_jynkt5	Trump Skips G20 Session on Coronavirus Pandemic and Goes Golfing Instead	
t3_jyecom	Rahm Emanuel Reportedly Being Considered for Biden's Cabinet, a Choice That Would Be a Slap in the Face to Black Voters	
t3_jy3mhv	Biden's margin of victory over Trump surpasses 6 million votes	
t3_jyeurt	Merrick Garland is being considered for Attorney General in the Biden administration	
t3_jyi5ye	Trump goes golfing in middle of G20 summit	
t3_jyhutc	Obama jokes that Navy SEALs could remove Trump from the White House	
t3_jy58b1	Senators who urged ‘voters to decide’ impeachment won’t admit Trump lost the election	
t3_jycdqu	Why Can Trump Try To Steal The Election? Blame The Electoral College.	
t3_jyo98b	Sen. Toomey congratulates Biden as president-elect after judge rules against Trump in Pa.	
t3_jyeldv	A new lawsuit alleges Trump’s effort to overturn Michigan’s election results disenfranchises Black voters	
t3_jyl1vt	Michigan GOP legislators appear at Trump Hotel after White House meeting	
t3_jyl2mf	Trump skipped a coronavirus meeting with G20 leaders to play golf	
t3_jyc5ef	Trump options narrow as Michigan backs Biden win	
t3_jyk7x7	Trump campaign again seeks to stop certification of Pennsylvania's election results	
t3_jymdi0	President-elect Joe Biden’s transition team is one of the most diverse ever Biden wants his administration to “look like America.” His transition team is a start.	
t3_jyoleb	Kayleigh McEnany said Trump wasn't given an 'orderly transition of power' in 2016. He was.	
t3_jyf2se	Georgia GOP governor says he understands Trump's frustration, but maintains he's following state laws	
t3_jy7n7y	Conservative News Site Warns Trump: 'Concede And Move On'	
t3_jyht3y	Pompeo’s Grotesque Farewell Party in Israel Shows That the Trump Team Knows It's Over — Pompeo used his visit to Israel and the settlements to push forward his pet ideological project and advance his post-Trump political career.	
t3_jyh7e5	Cuomo tells Biden $500 billion in stimulus funds needed to bail out states	
t3_jy30hq	U.S. Sen. Marsha Blackburn, a Trump ally, refers to Biden as 'president-elect'	
t3_jyauqo	Conspiracy theories are Trump ‘weapons’ in desperate bid to cling to power	
t3_jyomso	GOP senator congratulates Biden, says Trump should accept results	
t3_jy1h8p	Twitter says it will give @POTUS account to Biden on Inauguration Day	
t3_jyjvqh	'A Disgrace': Trump's DOJ Schedules Three More Federal Executions in Days Before Anti-Death Penalty Biden Takes Office	
t3_jy2k5b	Michigan attorney general ponders criminal probes of state and local officials who bend to Trump’s will on overturning election results	
t3_jyl2il	Joe Biden wants a $15 minimum wage — here’s what’s standing in his way	
t3_jy853m	US Chamber of Commerce chief calls on Trump to stop delaying transition to Biden presidency	
t3_jy94n0	Trump considers targeting birthright citizenship with executive order in his last weeks in office, report says	
t3_jyca1s	The Trump campaign’s much-hyped affidavit features a big, glaring error	
t3_jy2blr	Steven Mnuchin Swears He’s Not Tanking the Economy Just to F--k Over Joe Biden: Strangely, not everyone believes him.	
t3_jyi6td	Trump steps on Michigan lawmakers' message in tweets after meeting	
t3_jy0nxd	Donald Trump Jr tests positive for coronavirus	
t3_jy0een	Rudy Giuliani's Son Potentially Exposed Most of Trump's Legal Team to COVID During RNC Press Conference	
t3_jymhl2	Experimental drug given to Trump to treat covid-19 wins FDA clearance	
t3_jy06aa	After Trump meeting, Michigan GOP lawmakers say they’re not aware of any info that would change Biden’s victory in state	
t3_jy38ap	Biden will receive @POTUS Twitter account on Jan. 20 even if Trump doesn't concede, company says	
t3_jy2j68	Arizona’s largest county certifies Biden win over Trump	
t3_jyoq50	Trump calls on GOP state legislatures to overturn election results	
t3_jyl201	A vindictive Trump seeks to undermine Biden’s presidency	
t3_jyemqz	Donald Trump Will Lose One Of His Twitter Accounts To Joe Biden On Inauguration Day. An account the president uses to retweet his conspiracy theories and vitriol will be wiped and handed over to the Biden administration.	
t3_jygefw	Who needs Russia? Loudest attacks on US vote are from Trump	
t3_jyn9w9	Blackburn refers to Biden as president-elect; spokesperson says GOP senator ‘misspoke’	
t3_jym2qo	Duty or Party? For Republicans, a Test of Whether to Enable Trump	
t3_jyjx9m	Romney vs. Chachi? Actor Scott Baio threatens to run against Utah senator in 2024 over Trump rebuke.	
t3_jy0o3b	Michigan and Georgia Republicans Just Crushed Trump’s Coup Dreams	
t3_jyo46m	Trump Seeks Expedited Appeal of Pennsylvania Ruling Against Effort to Toss Mail-In Ballots	
t3_jy1qop	After Trump meeting, Michigan GOP leaders say Biden's win still stands	
t3_jyga4y	Judge rules against Trump global media chief after firings	
t3_jy46k6	Letters to the Editor: Stop Donald Trump's coup. Impeach him again	
t3_jyj6sy	AP Fact Check: Trump's flailing effort resting on mendacity	
t3_jykoxb	Pete Buttigieg May Be Contender For Biden’s Cabinet | NBC News NOW	
t3_jylq42	Trump Orders Hasty Afghanistan, Iraq Drawdowns to Beat Biden Inauguration	
t3_jyj6r2	Judge rules against Trump global media chief after firings	
t3_jyj1x6	'GOP made a bed of nails': Scaramucci on Republicans appeasing Trump	
t3_jyfwel	Analysis: How Georgia proves Trump has no chance of winning	
t3_jy0iwa	Twitter will hand @POTUS to Biden on Inauguration Day, even if Trump doesn’t concede	
t3_jyom7w	Recount off to a slow start, especially in Milwaukee where Trump campaign observers object to thousands of ballots, envelopes	
t3_jyi1mt	"Trump campaign ""seeking to disenfranchise Black voters"" with election fraud claims: lawsuit"	
t3_jyaidt	The Danger (and Ineptitude) of Trump’s Failed Coup	
t3_jynt1e	Trump tells G20 leaders he wants to work with them ‘for a long time’	
t3_jyc1ze	Voice of America's 5 Months Under Trump CEO: Lawsuits, Bias Claims, And A Sex Scandal	
t3_jykt2t	Trump forges ahead with frantic effort to overturn election | Having exhausted many of his legal options, Trump is looking at other ways to subvert Joe Biden’s victory.	
t3_jyhkqu	Judge rules against Trump global media chief after firings	
t3_jydi88	The Fed Could Help Cash-Strapped Cities and States. Mnuchin Has Other Ideas. | The lame-duck Treasury secretary seems to want to sabotage Biden’s ability to stave off the pandemic’s economic impacts.	
t3_jxze94	Ivanka Trump distances self from dad’s election fraud claims as her own legal jeopardy grows	
t3_jy9t3x	Biden will receive @POTUS Twitter account even if Trump refuses to concede	
t3_jyby64	Business and World Leaders Move On as Trump Fights to Reverse Election | President-elect Joseph R. Biden Jr. is seizing the moment, not to aggressively confront the president he defeated, but to act presidential in his stead.	
t3_jyd786	Trump supporters plan D.C. rally two days before electoral college votes are cast	
t3_jxxkww	Bernie Sanders says the 'GOP has ceased to be a political party' and 'is now a cult' for staying silent on Trump's election attacks	
t3_jxz8g9	Georgia governor certifies presidential electors for Biden	
t3_jxxiya	Trump refuses to take questions after falsely claiming he won election in first media appearance in weeks. No sitting US president has falsely claimed an election victory from the Brady Briefing Room. Until Friday	
t3_jyau1p	GOP lawmaker patience runs thin with Trump tactics	
t3_jyjoh2	Election 2020 updates: Michigan GOP Speaker Chatfield drinks at Trump Hotel; Carson was 'desperately ill' from COVID	
t3_jyn27t	FDA authroizes emergency use of Regeneron antibody treatment given to Trump	
t3_jy4cdz	Michigan group sues Trump campaign citing disenfranchisement of Black voters - The plaintiffs say the campaign's legal challenges to the election violated their voting rights.	
t3_jybvp1	Twitter will give @POTUS handle to Joe Biden on Inauguration Day	
t3_jydlai	Biden to Work to End Executions as Government Sets 3 More	
t3_jy8vfz	Fareed Zakaria: Trump presidency is stomping on the face of democracy forever	
t3_jye8sy	Latinas for Trump founder unseated Florida Democrat after seeing ‘shadow candidate’ enter race	
t3_jxwbg1	Trump accuses Pfizer and Moderna of working to stop his re-election	
t3_jy38k5	CNN's Brianna Keilar rolls the tape on Donald Trump's history of baselessly claiming election fraud	
t3_jyfwyr	GOP Sen. Blackburn Calls Biden President-Elect, but Later Takes it Back	
t3_jy0jkm	Trump Is Still Raging Against Democracy. But It’s Time To Applaud The Tenacity Of Voters, Poll And USPS Workers	
t3_jygj58	Joe Biden Turns 78 and Will Be the Oldest President — After Trump Broke the Record Right Before Him	
t3_jyh2tm	Trump's 'Death Star' strategy: Forcing a fight over states' electors	
t3_jyiov7	For Netanyahu and Israel, Trump’s Gifts Kept on Coming. Allowing the convicted spy Jonathan Pollard the ability to emigrate to Israel was just the latest in a long list of prizes for America’s closest ally in the Middle East.	
t3_jyn8ch	FDA authorizes Regeneron's Covid treatment, taken by Trump, for emergency use	
t3_jy5qo8	Biden's margin of victory widens as Trump's subversion efforts grow more frantic	
t3_jykdgu	Trump denies Georgia's results after hand recount; prompts concerns over January's Senate runoff	
t3_jyg473	Battered by setbacks in push to reverse Biden win, Trump persists with fraud claims	
t3_jy0zg7	Editorial: Trump’s effort to steal the election is a step toward fascism in America. If you call yourself a patriot, you can’t support it	
t3_jxv4xn	More GOP Senators Have COVID Than Have Acknowledged That Joe Biden Won	
t3_jyar6j	Coronavirus updates: Donald Trump Jr. tests positive; model estimates 471k US deaths by March; Cuomo to receive International Emmy	
t3_jxvrvz	Nancy Pelosi calls Trump a 'psychopathic nut' as the president continues to try to overturn the election results	
t3_jyoyk0	U.S. judge calls Trump claim challenging Biden win in Pennsylvania 'Frankenstein's Monster'	
t3_jye1kw	Justice Dept. meets Trump, Giuliani vote-fraud claims with silent skepticism	
t3_jxv07i	Ivanka Trump: How Dare You Investigate My Father for Tax Fraud, Which He Definitely Didn’t Use Me to Commit	
t3_jykqsr	Trump's Michigan election ploy: How it works, and why experts say it will fail	
t3_jxybf2	'Certify the Results!': Michigan Lawmakers Blasted for 'Legitimizing a Fascist Coup Attempt' by Meeting With Trump	
t3_jy79iv	Trump’s monumental sulk: president retreats from public eye as Covid ravages US | Two weeks after his defeat, Trump has gone from always present to effectively missing, behavior that many say is an unprecedented and dangerous	
t3_jyjz6o	Trump privately plots his next act - including a potential 2024 rematch	
t3_jyibg1	Trump addresses virtual G-20 summit, heads out before session on pandemic	
t3_jygnh6	Here’s when Biden’s win becomes official — and how Trump is trying to prevent that | With key deadlines looming, derailing the certification of results is part of the president’s strategy	
t3_jy9z3h	Trump tries to leverage power of office to subvert Biden win	
t3_jyll6a	Trump’s State Department to defund international non-profits that support BDS	
t3_jye2au	No Take Backs! Blackburn Spox Says GOPer Didn’t Mean To Call Biden President-Elect	
t3_jxu6uj	Georgia certifies that Joe Biden won the recount	
t3_jyfd5c	I met ‘monster’ reality TV star Donald Trump 16 years ago. The reality of him has been monstrous . . .	
t3_jyiblz	Republican Resistance Looms in the Senate for Biden’s Nominees	
t3_jxwnu3	Detroit asks judge to sanction Trump campaign for spreading 'disinformation'	
t3_jxyoqs	The Perils of Not Prosecuting Trump Joe Biden is wary of a legal reckoning against his predecessor, but to let Trump go would be to sanction future corruption.	
t3_jxuobg	Trump's legal team seemingly didn't notice its allegation of election fraud in Michigan is based on data from Minnesota	
t3_jyewe9	Plagued by COVID outbreaks, the meatpacking industry could be forced to change under Biden	
t3_jy2fn8	President-elect Joe Biden Asks Public to Fund Transition as Trump Refuses to Concede	
t3_jxtgbd	Trump’s press secretary Kayleigh McEnany heckled in briefing: ‘When will you admit you lost?’	
t3_jyfthv	Twitter will transfer presidential accounts to Joe Biden on Inauguration Day	
t3_jyedlw	Biden team solicits donations to fund presidential transition as Trump administration blocks federal money	
t3_jy8elg	Most Republicans greet Trump’s push to overturn the election with a customary response: Silence	
t3_jygf1z	Biden could announce Cabinet picks as soon as next week	
t3_jxyws8	Republican leaders swore an oath to defend the Constitution. That means telling Trump it’s over.	
t3_jy2mf4	Anger builds in Black community over Trump’s claims of voter fraud in big cities	
t3_jydvyu	How Georgia's pro-Trump election chief became the bane of the GOP	
t3_jyhazf	Trump's monumental sulk: president retreats from public eye as Covid ravages US	
t3_jyfrde	Senator Shirkey and Speaker Chatifeld’s names projected on Trump International Hotel	
t3_jycskf	Paris agreement gets 'new lease on life' under Biden, climate advocates say	
t3_jyek1t	Trump’s last-ditch efforts to overturn results fail to make dent in Biden victory	
t3_jykpz9	The Cabinet Appointments That Really Matter In The Incoming Biden Administration	
t3_jxsa0k	Merrick Garland Among Biden Candidates For Attorney General, Sources Say	
t3_jxwqi6	'Call his bluff': Edward Norton lays out poker-style Trump analysis we never expected	
t3_jxz6rl	White Nationalist Appointed by Trump to Holocaust Commission Praised Jeffrey Epstein for Not Being “a Pussy”	
t3_jxthva	Georgia Secretary of State Certifies Biden’s Win After Audit	
t3_jyee44	Trump to lose @POTUS Twitter account on January 20	
t3_jye9pq	What to make of more than 70m Americans who voted for Trump? — As of today, 73,781,603 people voted for Trump, which amounts to 47.2 percent of the total votes counted.	
t3_jygf7w	Twitter will hand @POTUS account to Biden on Inauguration Day	
t3_jxrln3	Hoyer on Trump election challenges: 'I think this borders on treason'	
t3_jycumy	How Members of Anti-Immigrant Extremist Groups Have Worked Closely with — and Joined — the Trump Administration	
t3_jxrbox	Republican Senator Lamar Alexander urges Trump to begin Biden transition	
t3_jyhbq0	Biden faces a race against the clock for U.S. to rejoin Iran nuclear deal	
t3_jy3a7r	After Trump meeting, Michigan GOP lawmakers affirmed Biden will win the state and urged Trump to focus on the COVID-19 pandemic currently ravaging the US	
t3_jxs3ay	Trump Camp Outraged Georgia Recount Counted The Votes	
t3_jya79l	People Think Mnuchin Accidentally Said Trump Admin’s Most Honest Thing About COVID-19	
t3_jygps8	Trump nominee's long road to Fed may be dead end	
t3_jybvbl	Analysis: With silence, GOP enables Trump's risky endgame	
t3_jxqqb8	Ivanka Trump’s Rage-Tweets About Ongoing Tax Fraud Investigations Have Serious Potential to Hurt Her Legal Defense	
t3_jyeh3g	Trump’s last-ditch efforts to overturn results fail to make dent in Biden victory	
t3_jycvon	Twitter to hand over @POTUS account to Biden on January 20	
t3_jy5c91	Trump Got Tricked by a Twitter Troll Posing as His Sister	
t3_jy09dz	Opinion: Hold President Trump accountable for his misdeeds	
t3_jxq0yf	Biden Must Keep His Word and Allow Investigations of Trump to Proceed	
t3_jygqmu	Republicans demand Michigan delay certifying Biden win for ‘audit’ of Detroit vote	
t3_jyhe14	Trump tells G20 leaders he wants to work with them ‘for a long time’	
t3_jxuc2q	Trump Is No Longer the Problem. His Army of Followers Is.	
t3_jyiop6	Trump attacks big Pharma, announces programs to lower drug prices	
t3_jyeey7	Biden to work to end executions as government sets 3 more	
t3_jxxrc7	Georgia secretary of state certifies election results that show state’s voters chose Joe Biden for president	
t3_jxqskc	Michigan Republican leader is meeting with Trump at White House to discuss coup	
t3_jy4ekt	Twitter says it’s handing @POTUS account over to Joe Biden on Inauguration Day	
t3_jxpd0y	Georgia Secretary of State to certify election for Biden	
t3_jxvr8r	Biden is considering making Merrick Garland, denied Supreme Court seat, the attorney general	
t3_jybm3w	Trump maintains unproven 'massive' fraud claim after meeting with Michigan lawmakers	
