Name	title	coding	
t3_jzjzln	A Neighbor You Like Probably Voted For Trump	I	
t3_jzuvjc	Trump Administration Begins Transition Process	L	
t3_jzqca2	"Trump scores two wins as Michigan legislature, federal appeals court agree to election reviews"	S	
t3_jz7p9d	"In Apparent Glitch, Voting Machines Hunt Down And Murder Trump Supporters"	I	
t3_jz5rv6	Trump campaign says Sidney Powell not a member of legal team	I	
t3_jzjptq	Two-thirds of GOP voters support Trump running for president in 2024: survey	I	
t3_jzitza	"Why The Left Can Be So Ridiculously Self-Righteous Without Realizing It -- What we saw in the lead up to the elections, and what we’ll witness for years to come, is utter contempt for Trump voters and conservatives in general."	I	
t3_jznr0d	Appeals Court Grants Expedited Review of Trump Campaign's Pennsylvania Lawsuit	S	
t3_jzloh0	Watergate journalist Carl Bernstein outs 21 Republican senators who 'privately' expressed 'extreme contempt' for Trump.	I	
t3_jzjlmh	Democrat House Losses Stemmed From Trump Increasing Voter Turnout: Rep. Richmond	L	
t3_jzo4tp	Journalist Carl Bernstein names 21 GOP senators who 'privately expressed their disdain' for Trump	I	
t3_jzpdpe	Trump's election lawsuit leads to 3rd Circuit grant for expedited review	S	
t3_jzn4sl	"Biden proposes John Poulos, CEO and President of Dominion Voting Systems, as Surgeon General and Head of Covid Analytics. Dominion will now be solely in charge of recording and keeping an exact count of what has become the most deadly virus in"	I	
t3_jzpzzc	Janet Yellen Is Biden’s Pick for Treasury Secretary	I	
t3_jzmj9c	Political Enemy List Trump Accountability Project Publicly Posted on Their Website	I	
t3_jzq15s	Rush Limbaugh: Trump Needs to Hold Rallies in Georgia	I	
t3_jzi0vw	5 More Ways Joe Biden Magically Outperformed Election Norms	L	
t3_jzijpr	"Trump Pulls Out Of Military Transparency Treaty With Russia, Europe"	I	
t3_jzrhs0	Biden's Treasury Secretary: Janet Yellen	I	
t3_jzntsc	GOP Former National Security Officials Urge Party to Demand Trump Concession	L	
t3_jzi8g6	Trump’s legal team’s statement on Sydney Powell was made to focus on the upcoming Supreme Court case. There are two separate legal pathways. One on equal protection and PA voting rules (most important right now). The second is Dominion soft	I	
t3_jz9dqx	Lou Dobbs Warns the GOP: Republican Party ‘Will Be Gone and Done’ If They Don’t Stand With President Trump	I	
t3_jzl6re	5 More Ways Joe Biden Magically Outperformed Election Norms	L	
t3_jzv44u	Trump Supporter Charged with Simple Assault for Breathing on Protesters	I	
t3_jzqyu6	Joel Kotkin: The Green End Game Runs Through Biden	I	
t3_jzjgop	Open Letter Calls on Harvard to Create 'System of Accountability' for Inviting Trump Admin Alums to Campus	I	
t3_jzmy0e	"'Joe Biden is a very weak President, could start wars': Chinese government advisor | World News - Times of India"	I	
t3_jz2tha	"Trump obsession: Democrats tweet about him 12,569 times to 486 about Biden"	I	
t3_jzvcjq	Biden's national security adviser pick played key role in Clinton email scandal	I	
t3_jzkul5	Trump: More Votes Than Voters in Key Swing States	N	
t3_jyzq16	Putin Says He’s Not Ready to Recognize Biden as U.S. President	I	
t3_jyzpvt	"How Trump Responded When Liz Cheney Called on Him to Concede: ''''Sorry Liz, can’t accept the results of an election with hundreds of thousands of fraudulent votes cast, enough to easily flip the Election. You’re just unhappy that I’m bri"	s	
t3_jzo3u5	Obama's third term: Biden reveals first cabinet picks	I	
t3_jzbqm7	"Trump campaign demands recount, signature matching in Georgia"	S	
t3_jz7frn	Trump Campaign Formally Requests a Recount in Georgia	S	
t3_jzu0lg	Walter Mead: Biden’s Foreign-Policy Team Takes Shape	I	
t3_jzkxnl	Professor causes uproar asking Biden voters to unfriend him	I	
t3_jz5fzn	Federal judge dismisses Trump campaign’s Pennsylvania case	L	
t3_jzmvum	Appeals Court Grants Expedited Review of Trump Campaign's Pennsylvania Lawsuit	S	
t3_jzhelc	Mike Flynn Jr. adds twist to Trump team’s statement on Sidney Powell: ‘Give this the 24hr rule …’	I	
t3_jzverf	"Trump’s Case is a Constitutional One, Sidney Powell's is a Criminal One"	I	
t3_jzv491	Reince Priebus reacts to Wis. Dems' rule-change try following Trump recount filing: ‘You can’t make this up!'	S	
t3_jyvpw5	BREAKING: FDA Grants Emergency Use Authorization To Antibody Cocktail Used By Trump	I	
t3_jyxl1z	How to explain Latino support for Trump? ABC News reports misleading memes went viral in Latino communities	I	
t3_jzq2wb	Sidney Powell responds to Trump Campaign legal statement with agreement but an “epic” lawsuit is still coming this week	I	
t3_jz5f71	Julie Burchill: President Trump has loved and been great for Israel	I	
t3_jyymh1	Reap What You Sow: Media Who Coddled Biden for Months Now Complain About Mistreatment	I	
t3_jz447i	Omar Urges Biden To Reverse Trump's Agreements In The Middle East And Claims They Were ''''Not Peace Deals''''	I	
t3_jywg7k	"Devout Catholic Joe Biden, our most pro-abortion president"	I	
t3_jyz99e	Trump Lawyer Sidney Powell Promises 'Biblical' Lawsuit in Coming Days	I	
t3_jz3j9r	"BLM Founders Demand Joe Biden Support A 'Roadmap' To Abolition Of Police, Prisons"	I	
t3_jz37gc	Trump Derangement Syndrome in Democrats won't go away with Trump	I	
t3_jywdz5	Philly Bans All Indoor Gatherings Unless You're Still Counting Biden Votes	N	
t3_jyunuj	Trump campaign adviser Steve Cortes: Sudden Stop In Mail-In Vote Count 'Suspicious' -- Particularly since it was followed by a ''''deluge'''' of votes for Joe Biden in key battleground states.	S	
t3_jyulqn	Trump Team Files for Fresh Recount in Georgia’s Presidential Race	S	
t3_jylbj0	CNN Condemns Trump Rallies As 'Physically Peaceful But Morally Violent'	I	
t3_jz60sj	Dominion responds to Trump team claims	I	
t3_jznsl5	"Biden secretary of state pick Blinken criticized over Iraq War, consulting work"	I	
t3_jz56nz	GOP senator says Trump to Biden transition should begin 'tomorrow morning'	L	
t3_jyxyyy	China Issues Instructions for ‘Incoming Biden Administration’	I	
t3_jyjte3	Ilhan Omar Urges Biden to ‘Reverse’ President Trump’s Middle East Agreements -- Thinks that peace between Israel and Arab nations is a bad thing.	I	
t3_jz7fr3	Latest: Why a Federal Judge Tossed Out One of the Trump Campaign's PA Lawsuits	L	
t3_jzaqqe	An statement from Senator Toomey regarding the Pennyslvania Federal Court decision regarding the Trump campaign lawsuit.	I	
t3_jyl85p	Judge Dismisses Trump Campaign Suit to Invalidate PA Election Certification With Prejudice	L	
t3_jyqh97	"Chinese Warn Against Communism at Trump Rally, Tell Americans to Speak Out"	I	
t3_jylfat	Hispanic Voters In Florida Who Fled Dictatorships Think The Election Was Stolen From Trump	I	
t3_jzaje9	Scranton dedicates 'Joe Biden Way' to honor president-elect	I	
t3_jz3bhq	Pennsylvania election: Trump appeals dismissal of bid to block vote certification	S	
t3_jzhbcz	The Death Star Strategy: Is Trump Contemplating The Ultimate Constitutional Trick Shot?	I	
t3_jyztx6	Do Trump Supporters Live in an Alternate Universe?	I	
t3_jzsxow	Trump Lawyer: Michigan Legislature Agrees to Hold Election Review Hearings	L	
t3_jzrh4s	Hours After Biden Picks Blinken For Secretary Of State – His Closet Door Swings Open On Iraq And Consulting	I	
t3_jzu5h2	The Socio-Political Legacy 0f Trump	I	
t3_jzrc5e	Rep. Nunes Worried Biden Will Shut Down Durham Investigation	I	
t3_jyp5q9	Actor Scott Baio threatens to move to Utah to unseat Sen. Mitt Romney after his anti-Trump tweet	I	
t3_jym9cn	Pennsylvania Judge Dismisses Trump Campaign's Challenge to Pennsylvania Election Law	L	
t3_jyusgt	Ben Carson: Trump Saved My Life After I Got COVID	I	
t3_jztzoa	The mullah report: is Biden bringing back the Iran Deal? | Spectator USA	I	
t3_jykyw7	Federal Election Commission Chair: Trump Campaign Has Legitimate Claims of Election Fraud	S	
t3_jztwv2	"Revolving Door: Obama Staffers Who Joined NBC, MSNBC, and CNN, Now Headed to Biden Admin"	I	
t3_jzt2hb	"Data: Trump's Anti-Globalism, Pro-Police Message Wins Over Hispanics"	I	
t3_jznbrr	U.S. Election: Trump legal team distances itself from lawyer after controversial comments - National | Globalnews.ca	I	
			
