Name	title	coding	
t3_jyqoj0	Dr. Ben Carson: Trump Saved My Life After I Got COVID	I	
t3_jytan4	Detroit voters sue President Trump over his attempt to block certification of election results	N	
t3_jz8s6s	"Mail in ballots come in envelopes. They have creases. ''''Ga Poll Worker Describes Pristine Mail In Ballots, 98% for Biden''''"	L	
t3_jyv0um	FDA Grants Emergency Use Authorization To Antibody Cocktail Used By Trump	I	
t3_jykt0d	Michigan AG Suggests Criminally Charging Republican Legislators for Meeting With Trump	I	
t3_jyaufj	Berkeley professor sparks outrage by claiming Trump supporters who have an 'indifference' to COVID are like Germans who 'ignored and profited from the Holocaust'	I	
t3_jyobi4	Michigan Legislators Face Calls For Possible Criminal Charges After Meeting With President Trump On Certification	S	
t3_jyn4xj	Trump campaign statement on Pennsylvania ruling	I	
t3_jyp3ti	Trump Lawyers: Pennsylvania Lawsuit Dismissal Moves Us Closer to Supreme Court	S	
t3_jysprc	FDA Grants Emergency Use Authorization To Antibody Cocktail Used By Trump	I	
t3_jyhhtr	"McEnany: Trump's path to victory is Supreme Court, exposing 'systemic' voter fraud"	S	
t3_jydj00	"LIVE: March for Trump in Atlanta, Georgia"	I	
t3_jydzd2	Twitter says it will hand control of US president's official account to Joe Biden on January 20 - regardless of whether Donald Trump has left the White House	I	
t3_jygs96	Merkel's Germany Tells Trump Not to Bring Troops Home from Afghanistan	I	
t3_jyfij4	"Georgia Gov. Kemp Calls for Audit, Says Trump Can Demand New Recount"	L	
t3_jy56dt	Trump Announces New Regulations Lowering Prescription Drug Costs	I	
t3_jykdwj	Twitter Plans To Hand @POTUS Handle Over To Biden On Jan. 20 No Matter What	I	
t3_jybrmo	Joe Biden's 'Vote Joe' website defaced by Turkish Hackers	I	
t3_jyqipn	Time is just not on Trump’s side to overturn 2020 election results	I	
t3_jy9egu	Joe Biden loses it at reporter who asked about kids going back to classrooms - then tells press to leave	I	
t3_jygoog	Trump voters back the President’s charges of election fraud led by Democrats	S	
t3_jy248u	Anti-Trump Legal Team Withdraws In Pennsylvania	L	
t3_jy8qby	"Joe Biden: Why Are Reporters Asking Me Questions? On Friday, Biden appeared dumbfounded as to why a reporter was asking the projected Democratic presidential-elect a question as the press pool was being scurried away by staff."	I	
t3_jy4x55	Harvard Students Demand That Trump Officials Be Preemptively Barred From Campus	I	
t3_jyhsxr	Brian Williams mocks Geraldo Rivera suggestion to name COVID-19 vaccine after Trump	I	
t3_jybfam	"BLM, Squad members pushing Dems, Biden to abolish prison"	I	
t3_jy2icm	Donald Trump Jr. tests positive for COVID-19	I	
t3_jyb4tl	6 Big Claims by Trump’s Lawyers About Overturning Election Results	S	
t3_jybaah	"Rudy and Sidney’s Krakentastic Spectacle, and What It Could Mean -- A dismissive legacy media might have panned Team Trump’s press conference Thursday, but it was a significant moment with significant portents."	I	
t3_jygabf	Ilhan Omar Urges Biden To ‘Reverse’ President Trump’s Middle East Agreements	I	
t3_jy1csd	Hispanic Voters in Florida Feel Election Was Stolen from Trump	I	
t3_jz593p	'This Obama judge' is 'outrageous': Mark Levin blasts PA ruling dismissing Trump voter fraud challenge	S	
t3_jz0c9x	Satire: CNN Condemns Trump Rallies As 'Physically Peaceful But Morally Violent'	I	
t3_jzr4dw	"Michigan elections board certifies results from presidential election, sealing Biden’s win in state"	L	
t3_jzo4ys	"To Prevent 'Active Sabotage' of His Agenda, Biden Urged to Clean House of Trump Loyalists on Day One"	I	
t3_jzmvi7	"Trump's on his way out, but leaves a lasting legacy: The right's open embrace of terrorism. How did the Kenosha shooter post $2 million in bail? Because conservatives are normalizing right-wing terrorism"	I	
t3_jzmb5h	Detroit had more vote errors in 2016 when Trump won Michigan by a narrow margin. He didn’t object then.	L	
t3_jzos3p	It’s Time To Consider Sanctions for Trump’s Legal Team	I	
t3_jznq3n	Clip of Ted Cruz Saying Democrats Would Say COVID 'Magically Better' Week After Biden Wins Resurfaces	I	
t3_jzonsl	Former Defense Secretary Jim Mattis says Biden should toss all of Trump's 'America First' policies	I	
t3_jzka2y	Pro-Trump Attorney Urges Republicans Not to Vote in Georgia Runoff	S	
t3_jzjwz1	100 Republican national security experts demand GOP admit Trump loss	L	
t3_jzpeei	Trump Is Blowing Up the Georgia GOP—and It Couldn’t Happen at a Better Time	I	
t3_jzj864	Business Leaders Tell GOP: Start Biden Transition or No Money for Georgia Senate Run-Offs	S	
t3_jziz6f	Trump will leave office soon. But we can’t let him escape accountability for his misdeeds.	I	
t3_jzm9x0	Biden picks John Kerry for climate envoy on national security council	I	
t3_jzgzo5	"Trump is not just refusing to concede, he is sabotaging nation’s interest"	S	
t3_jzpowr	Let’s hear it for the judges for dismissing Trump’s lawsuits	L	
t3_jzmtno	Tucker Carlson was attacked by Trump supporters for questioning the outlandish claims of the president's lawyer Sidney Powell before she was fired	I	
t3_jzj8y9	Republican pollster: Trump's false 'rigged' election claims may hurt GOP chances of keeping Senate	S	
t3_jzfuso	Trump team falsely claim he was not assisted in transition by Obama	N	
t3_jzicmc	How Ronald Reagan’s Racism Helped Pave the Way for Donald Trump’s	I	
t3_jzpllg	The Already Useless Trump Kids Are About to Get Even More So	I	
t3_jzkjrv	Biden team is reportedly pushing congressional Democrats to strike an immediate stimulus deal with Republicans to stave off renewed recession	I	
t3_jzmfmo	President Trump Wanted a Supreme Court Election Battle. His Current Appeal Simply Cannot Get Him There.	I	
t3_jzlc67	GOP Sen. Rob Portman says Biden transition funds should be released	I	
t3_jzgz98	John Kasich Stunned GOP Isn’t Defending Democracy Against Trump	I	
t3_jzg091	Biden is stealing the spotlight. Trump can't stand it.	I	
t3_jzlnvy	A major Trump donor’s company got a 3 percent government-backed pandemic loan. It sells title loans at a 350 percent annual rate.	I	
t3_jzpy16	"On Trump, GOP's silence 'can't be excused and won't be forgiven' — For the first time, a corrupt US leader is trying to cling to power through autocratic means. Let history note who lacked the patriotism to speak up."	I	
t3_jzpvbh	Rush Limbaugh criticizes Trump legal team for promising 'bombshells' and failing to deliver	I	
t3_jzeymy	New Zealand PM offers COVID-19 help to U.S. President-elect Biden	I	
t3_jzj73m	Trump’s press secretary Kayleigh McEnany heckled in briefing: ‘When will you admit you lost?’	I	
t3_jzrwc2	Pennsylvania Supreme Court Kills Trump Bid to Disqualify Ballots	L	
t3_jzq2dw	Poll: Majority say Trump should concede	L	
t3_jzlqyf	"GOP senator says Biden's vote lead 'has not changed,' urges country to 'move forward'"	L	
t3_jzh7ew	Carl Bernstein names 21 Republican senators who have ‘privately’ expressed ‘extreme contempt’ for Trump	I	
t3_jzhuwc	New Zealand offers Biden tips on COVID-19 after successful response	I	
t3_jzny0i	"Pennsylvania Republicans Voted Against Certifying Vote in County Trump Won by 22,000"	S	
t3_jzskav	Pennsylvania Supreme Court Reverses One of Trump’s Only Post-Election Litigation Wins	S	
t3_jzgode	Trump axed campaign lawyer Sidney Powell was because 'she was too conspiratorial even for him'	I	
t3_jze8d0	Transition warning: Trump's mental illness is a growing danger	I	
t3_jzsk0y	Congress Has Every Right to Keep Investigating Trump After He’s Gone	I	
t3_jzqf5t	"Republican Congressman Says GOP 'Embarrassing,' Calls on Party to 'Denounce' Trump's 'Conspiracy Theories'"	I	
t3_jzsjjw	Over 100 CEOs threaten to cut off funds to Georgia GOP if Trump keeps blocking transition: report	S	
t3_jzr8dl	Michigan certifies Biden win despite Trump's GOP overtures	L	
t3_jztm0i	"Trump Campaign’s Actual Argument in Appeals Court: We’re Only Trying to Disenfranchise 1.5 Million Voters, Not 6 Million Pennsylvanians"	S	
t3_jzs0fi	Michigan Certifies Joe Biden's Election Victory	L	
t3_jzmam7	Trump's top election lawyer in Wisconsin says he and his wife voted illegally in the campaign's latest legal argument	S	
t3_jzhcb0	"What if Trump never concedes? The Constitution will end his term, conservative lawyer John Yoo says"	I	
t3_jzj1p6	"Group of Black voters in Detroit suing President Trump, citing voting rights abuses &amp; disenfranchisement"	S	
t3_jzmqas	Conservatives spread false claim Biden invented 'office' of the president-elect	S	
t3_jzrmc0	"Trump’s Ridiculous, Sloppy Coup Attempt Just Face-Planted in Michigan"	L	
t3_jzrlc7	Maine certifies Biden’s victory in the state’s election	L	
t3_jzjoc9	Republican former national security officials urge party to demand Trump concession	L	
t3_jzs4qi	Detroit had more vote errors in 2016 when Trump won Michigan by a narrow margin. He didn’t object then.	L	
t3_jzguka	"Trump handing Taliban a victory on his way out, says former national security adviser H.R McMaster"	I	
t3_jzsjpm	Trump is reportedly worried that his legal team is made up of 'fools that are making him look bad'	I	
t3_jzsr22	"Michigan certifies election results, making Biden's win official"	L	
t3_jzmus9	"Donald Trump’s Bid to Steal the Election Hinges on a Shameless Homophobe Who Once Called Him a Lying, Idiotic Bully"	I	
t3_jzb2zh	"Twitter Afire After Trump Camp Breaks With Lawyer: Lasted ‘About Half A Scaramucci’ | “Sidney Powell should refuse to concede her position from Trump’s legal team,” one critic joked."	I	
t3_jztjh2	National Embarrassment Donald Trump Worried Lawyers Are Sullying His Pristine Reputation	I	
t3_jzgsx3	"Trump legal team says Sidney Powell had no formal role, but record shows they loved her involvement"	I	
t3_jzla7n	Michigan voters sue Trump for allegedly disenfranchising Black voters with election interference	S	
t3_jzqg3e	Trump campaign suffers new court loss in attempt to block Biden’s win in Pennsylvania	L	
t3_jzr77v	"Michigan board votes to certify the state’s election results, dealing Trump another blow"	L	
t3_jzis32	Carl Bernstein named 21 GOP senators who he said are enabling Trump's attempts to subvert US democracy by only criticizing him in private	S	
t3_jzu2rx	"Michigan Certifies Election Results, Declaring Biden Winner In New Blow To Trump"	L	
t3_jzbb0y	Reporter Carl Bernstein names 21 GOP senators who 'repeatedly expressed extreme contempt for Trump'	I	
t3_jzqk4b	Secret Service members asked about protecting soon-to-be-former president Trump full time in Florida: Sources | Agents in Trump's detail have been asked about relocating to West Palm Beach.	I	
t3_jztlp5	G.M. Drops Its Support for Trump Climate Rollbacks and Aligns With Biden	I	
t3_jzqzld	"Trump campaign forces Georgia taxpayers to pay for second recount after first one confirms its loss. A hand recount of nearly 5 million votes confirmed Biden's win, but Team Trump wants to milk taxpayers even more"	L	
t3_jzk7yg	A Federal Judge Rejected Trump's Ludicrous Pennsylvania Case With Pure Disdain	L	
t3_jzucnl	How Trump's tweets inadvertently mobilized hundreds of thousands suburban women against him	I	
t3_jzuphz	Trump goes out with a whimper and a tweet. It was always going to be that way	I	
t3_jzrye4	Michigan votes to certify Biden's win over Trump	L	
t3_jzuvas	Report of a 'souring' relationship between Trump and Giuliani	I	
t3_jzsruy	"Rush Limbaugh Does Full 180, Blasts Sidney Powell After Team Trump Disavowed Her"	I	
t3_jzr5yp	Michigan Certifies Joe Biden's Election Victory	L	
t3_jzlbdp	Trump friend and adviser Steve Schwarzman recognizes Biden as President-elect	L	
t3_jzm28z	Biden to nominate first Latino and immigrant to run Homeland Security	I	
t3_jzj1yp	"Major business leaders reportedly signed a letter urging Trump to concede, and warn that 'our democracy grows weaker' the longer the presidential transition is delayed"	S	
t3_jzlipn	Sidney Powell Stricken from Trump’s ‘Elite Strike Force’ Legal Team 8 Days After President Called Her ‘Wonderful’	I	
t3_jzis4d	Will Trump’s Accusers Finally Get Their Day In Court? | He soon will be unable to hide from the women suing him for defamation.	I	
t3_jz8bvm	"Native American voters across Minnesota turned out to oust Trump - Vote totals were up around Red Lake, and 90% for Biden"	L	
t3_jzs06l	"Michigan certifies Joe Biden's win despite Trump's GOP overtures | The Board of State Canvassers, which has two Republicans and two Democrats, confirmed the results on a 3-0 vote with one abstention"	L	
t3_jztkzj	"Trump fears Giuliani, other lawyers in Biden vote challenge are 'fools that are making him look bad'"	I	
t3_jzquzq	"GOP senator: No indication of widespread voting irregularities, window for Trump challenges is 'closing'"	L	
t3_jz828i	Yet another Georgia election official receives threats after state certifies Biden win	S	
t3_jzjbng	In Another Country This Would Be Called a Coup: Detroit NAACP Head on Trump Trying to Overturn Vote	S	
t3_jzn0c8	"Biden taps John Kerry as Special Presidential Envoy for Climate, marking the first time the NSC will have an official dedicated to climate change"	I	
t3_jz6vh9	Murkowski tells Trump: ''''It is time to begin the full and formal transition process''''	L	
t3_jzorhc	"Trump fears Giuliani, other lawyers in Biden vote challenge are ‘fools that are making him look bad’"	I	
t3_jz7cgh	"Trump dumps Sydney Powell, lawyer who promised to ''''blow up'''' Georgia, as legal strategy unravels"	I	
t3_jzozd1	"Why the Trump campaign’s big legal flameout in Pennsylvania seems like a turning point, even for Republicans"	I	
t3_jzji16	Trump's closest business ally just admitted that the president lost the election	L	
t3_jzobu4	"Behind the scenes, Trump frustrated with his legal team's maneuvers"	I	
t3_jzg8x4	'Elite Strike Force'? Trump Legal Team Throws Right-Wing Attorney Sidney Powell Under the Bus as Coup Attempt Flails	L	
t3_jziqei	Team Trump Fired QAnon Lawyer Sidney Powell But She's Tweeting Through It - Last week she was part of Trump's ''''elite strike force.'''' Now she's ''''practicing law on her own.''''	I	
t3_jzr5f1	Michigan Election Board Certifies Victory for Biden	L	
t3_jzt2gz	Whoopi Goldberg blasts Republicans not speaking against Trump: 'This is an attempted coup'	I	
t3_jzprxe	Trump’s Absurd ‘You Did It First’ Argument for Stealing the Election	I	
t3_jzpbvs	"Biden chooses former Fed Chair Janet Yellen to be Treasury secretary, report says"	I	
t3_jzofom	Biden moves forward as GOP breaks with Trump rise	I	
t3_jz67og	Trump Yet to Answer One Press Question Since Election As GOP Pressure for His Concession to Biden Grows	I	
t3_jzhsuf	Trump urges state legislatures and courts to ‘flip’ results	N	
t3_jz5qcv	"Brian Stelter Slams Lara Trump For Declaring Trump Voters Don’t ‘Feel’ That He Lost - “Facts do not care about your feelings,” the CNN host said."	I	
t3_jzsna1	King of Jordan becomes first Arab leader to speak with President-elect Biden	I	
t3_jzsfv2	Obama calls Trump era an 'anomaly' in Canada-U.S. relations	I	
t3_jzo44d	Two years ago this week Trump was mocking a turkey for refusing to concede an election	I	
t3_jzrzv8	Rush Limbaugh Knocks Trump's Lawyers For Not Providing Voter Fraud Proof	L	
t3_jzst4r	"Trump fears Giuliani, other lawyers in Biden vote challenge are 'fools that are making him look bad'"	I	
t3_jzrnx5	Michigan certifies Biden victory in another blow to Trump	L	
t3_jzjl2a	"Republican national security experts call on Trump to concede, begin transition"	L	
t3_jzfpdr	Donald Trump has assaulted our democracy	I	
t3_jz5bfz	Trump campaign says Sidney Powell isn't a member of its legal team	S	
t3_jzukkw	"Almost no Trump voters consider Biden the legitimate 2020 election winner, poll says"	s	
t3_jzs6yd	PolitiFact - Trump's Pants on Fire claim about votes exceeding voters in swing states	S	
t3_jzrztf	CEOs Urge Trump To Concede: 'Not A Moment To Waste' In Fighting COVID-19	I	
t3_jzr88b	"Michigan election board certifies 154,000-vote victory for Joe Biden, another setback in Trump’s effort to overturn election results"	L	
t3_jzmeyu	New report details Trump effort to seize thousands of acres of private land for border wall	I	
t3_jzsm35	"Michigan election board certifies 154,000-vote victory for Joe Biden, another setback in Trump’s effort to overturn election results"	L	
t3_jzu5pb	The Authors of the Dictator’s Handbook on What Trump Is Doing Wrong	I	
t3_jztaqs	Nancy Pelosi wants Senate hearings for Joe Biden’s nominees before Inauguration Day	I	
t3_jzkuz6	Trump Faces Growing Calls From Biz Leaders To Concede After Legal Battles Fall Flat	I	
t3_jzscgu	"GM Abandons Trump Admin in Lawsuit Over California Emission Standards, a Sign Automaker Knows Biden Will Be Taking Over"	I	
t3_jzv0k7	"Politicizing masks ‘is like politicizing toilet paper,’ Biden coronavirus adviser says"	I	
t3_jz4z41	"No, You Do Not Have to Feel the Trump Voter's Pain | There is no reason, after five and half years of untruths, dog-whistles, slurs and conspiracies, and weeks of Trump trying to undermine Biden’s win, to hug the people who want to disenfranc"	I	
t3_jzr7kz	Michigan Certifies Joe Biden's Election Victory	L	
t3_jzsmiy	Trump Fires Sidney Powell for Election Conspiracies as Though He’s Not About to Claim China Paid Poll Workers to Change All the Ballots to Biden	S	
t3_jzrvao	Michigan votes to certify Biden's win over Trump	L	
t3_jzp967	"General Motors Aligns With Biden, Pulls Out of Lawsuit Supporting Trump"	I	
t3_jzntq8	GM flips to California’s side in emissions lawsuit against Trump admin	I	
t3_jz6gek	Trump campaign cuts Sidney Powell from president’s legal team - The abrupt shake-up comes as Powell makes far-fetched and unsupported claims of voter fraud in the 2020 elections.	S	
t3_jz7lhm	"Edward Norton tears into 'whiny, sulky, petulant, Grinchy, vindictive' Donald Trump in pointed, poker-laced Twitter thread"	I	
t3_jzrkeu	Michigan Certifies Election Results Showing Biden Victory	L	
t3_jz44h2	Bernie Sanders says GOP ‘has ceased to be a political party’ and is now a ‘cult’ in fiery rebuke of Trump fraud claims	I	
t3_jz9j48	Kasich: Republicans 'either in complete lockstep' or 'afraid' of Trump	I	
t3_jzr8aw	Michigan election board certifies Biden win	L	
t3_jzs7ix	G.M. Drops Its Support for Trump Climate Rollbacks and Aligns With Biden	I	
t3_jzreko	Michigan's state board certifies Biden's win	L	
t3_jzlcxd	"Trump Could Push Don Jr. and Ivanka in 2024, but Trumpism Is a Hard Sell Without Him"	I	
t3_jzphue	"GOP senator, business leaders urge prompt Biden transition"	L	
t3_jzseje	National Security Experts Urge Republicans To Demand Trump Concede The Election	L	
t3_jzt627	Michigan's Board Of State Canvassers Certified Biden's Win In A Big Loss For Trump's Desperate Bid To Overturn The Election	L	
t3_jzej98	"Pennsylvania’s Lt. Gov. Trolls Trump, ‘Dopey’ GOP Lawsuits In Epic Tweetstorm"	I	
t3_jztt46	“Let’s Buy Trump Off So He Shuts the F--k Up”: Will Rupert Murdoch Spring for a Post-Presidential Fox Gig?	I	
t3_jztfqa	Trump Wars II: The Loser Strikes Back	I	
t3_jzrtop	"Bipartisan Michigan election board certifies Biden’s win on 154,000-vote margin"	L	
t3_jz3tl3	Michael J. Fox says Donald Trump has played on 'every worst instinct in mankind': 'Biff is president!'	I	
t3_jzv6i4	‘Bye bye Trump’: Ilhan Omar and others celebrate as president finally begins transition	L	
t3_jzeqq0	Opinion | Why Biden should stop parsing words and call Trump's lies a coup	I	
t3_jzs5wi	"Michigan board votes to certify the state’s election results, dealing Trump another blow"	L	
t3_jzba0d	Carl Bernstein names 21 GOP senators who 'privately expressed their disdain' for Trump	I	
t3_jzlzl3	"After looming so large in Washington, Donald Trump has shrunk into a small, petty man"	I	
t3_jzszzy	Vladimir Putin wasted no time in weaponizing Trump's election conspiracies to spread Russian propaganda	S	
t3_jzp2ts	Joe Biden nominates first woman to lead intelligence and first Latino to head homeland security	I	
t3_jzcmj4	"New Zealand leader Ardern offers virus know-how to Joe Biden | New Zealand Prime Minister Jacinda Ardern has become the latest world leader to congratulate President-elect Joe Biden on his election victory, saying she offered to share her nati"	I	
t3_jzsbmo	Michigan certifies Biden win; a setback for Trump challenge	L	
t3_jzsrxm	General Motors abandons Trump in lawsuit fighting California on its own climate rules and vows to work on crisis with Biden	I	
t3_jzqp20	Trump-Appointed Judges Find Conversion Therapy Bans Unconstitutional	I	
t3_jzri76	Michigan board of state canvassers certifies results of November 3 U.S. presidential election for Democrat Biden	L	
t3_jzt9d7	"Trump’s Legal Team Tries (and Fails) to Disavow Conspiracy Theorist Attorney Sidney Powell: Unfortunately for Rudy Giuliani, Jenna Ellis, and the GOP, it’s not so easy to un-release The Kraken"	S	
t3_jzpvd8	Trump's bizarro-world 'elite strike force' legal challenge is about to implode	I	
t3_jzucjw	President-elect Biden reveals six key foreign policy and national security appointments	I	
t3_jzssf1	Leaders react after board certifies President-elect Joe Biden’s win in Michigan	I	
t3_jzoam2	Reality Forecloses on the Trump Presidency | A fading campaign collapses under the weight of finally having to back up big talk with actual substance.	I	
t3_jzuuec	Biden team wants to understand Trump effort to 'hollow out government agencies'	I	
t3_jztko1	"Biden's latest appointment, John Kerry, signals how the new administration will handle the climate crisis"	I	
t3_jzt3hn	"Drip by drip, U.S. Republicans edge away from Trump election claims"	L	
t3_jzk79i	Former GOP Ohio Governor Says Republicans Are Either ‘Afraid’ or ‘in Complete Lockstep’ With Trump	I	
t3_jztpkn	Biden's national security team 'represents the diversity of America'	I	
t3_jzr9x7	"Michigan election board certifies 154,000-vote victory for Joe Biden, another setback in Trump’s effort to overturn election results"	L	
t3_jz1z65	‘Stop golfing and concede’: Trump and Maryland Gov. Hogan spar again after president criticizes South Korean tests	I	
t3_jzup21	Biden signals sharp shift from Trump with Cabinet picks	I	
t3_jz227v	"GOP Senator Has Instructed Staff to Cooperate With Biden Transition, Says It's 'Past Time' for Trump to Do Same"	L	
t3_jzr85t	"Michigan election board votes to certify Biden win, dealing blow to Trump effort"	L	
t3_jzr751	"Michigan board votes to certify the state’s election results, dealing Trump another blow"	L	
t3_jzr6vb	Michigan's Board Of Canvassers Certified Biden's Win In A Big Loss For Trump's Desperate Bid To Overturn The Election	L	
t3_jzrl06	Chris Christie calls Trump's legal team a 'national embarrassment'	L	
t3_jziwyr	"What if Trump won’t leave the White House? A hostage negotiator, an animal-control officer, and a toddler whisperer have advice"	I	
t3_jz2pba	Small but growing number of Republicans tell Trump it’s over: “Stop golfing and concede”	L	
t3_jzhlu7	"Trump's 'elite, strike force' legal team starts to shrink"	L	
t3_jzfnsj	Biden to spotlight CDC officials shunned by Trump	L	
t3_jzr6u0	Michigan Certifies Joe Biden's Election Victory	L	
t3_jzpuu9	Election officials are facing death threats in key swing states where Trump is trying to overturn the results of the 2020 presidential race	S	
t3_jzr4ue	Michigan Election Board Certifies Victory for Biden	L	
t3_jzd94c	Carl Bernstein Names Names: 21 GOP Senators Who've Privately Ripped Trump	I	
t3_jz0akg	"Trump, GOP’s ridiculous, flailing coup isn’t a joke. It’s a crime. There must be consequences | Will Bunch"	S	
t3_jzo8pn	GM flips to California's side in pollution fight with Trump	I	
t3_jzn3cr	Biden Taps John Kerry For New National Security Role Focused On The Climate Crisis	I	
t3_jzrj8r	Michigan's state board certifies Biden's win	L	
t3_jzruwz	General Motors’ parting shot at Trump bodes well for the Biden presidency	I	
t3_jzogjj	John Kerry to join Biden administration as National Security Council official dedicated to climate change	I	
t3_jzopkn	Biden taps Alejandro Mayorkas as first immigrant to lead Homeland Security	I	
t3_jzn4mo	"Despite Trump’s prod, Mich. to consider certifying Biden win"	S	
t3_jzta4e	Trump Administration To Start Transition Process For Biden	L	
t3_jzqpbm	Rush Limbaugh criticizes Trump legal team for promising 'bombshells' and failing to deliver	L	
t3_jzti5c	GSA Sends Letter to Biden Making Resources Available for Transition	I	
t3_jzms1q	Pro-Trump Attorney Lin Wood Urges Republicans Not To Vote In Georgia Senate Runoff -- Unless GOP candidates help overturn the presidential election results in the state.	S	
t3_jzu0rh	Rush Limbaugh On Trump’s Legal Team: ‘They Promised Blockbuster Stuff And Then Nothing Happened’	L	
t3_jzua12	GSA notifies Joe Biden that Trump administration is ready to start transition process	I	
t3_jzlwxs	"Bombshell: Biden takes min 98% of a 23,487 vote batch at 12:18AM in GA"	L	
t3_jzfqzc	Do Trump-Supporters Live in an Alternate Universe? Actually a huge number of Americans have a false impression of reality because they are being told lies by their media. The people who constantly hear these lies do live in an ''''alternate re	I	
t3_jzu8wb	Trump accepts transition to Biden can begin	L	
t3_jzjbne	"Sidney Powell Confirms Non-Affiliation With Trump Legal Team, Vows to Continue Fraud Fight"	S	
t3_jznypc	Trump campaign takes Pennsylvania election fight to federal appeals court	S	
t3_jzud9p	Bernstein names 21 Republican senators who privately expressed contempt for Trump	I	
t3_jzk9j0	"Sidney Powell Responds to Trump Campaign's Statement Saying She's Not Part of Legal Team -- Powell said her fight will go on anyway and closed her statement with the hashtag, ''''#KrakenOnSteroids''''"	I	
t3_jzpd7w	JUST IN: Third Circuit Court of Appeals Grants Expedited Review For Team Trump’s Appeal in Pennsylvania	S	
